.488034 IP 165.22.226.250.ssh > 66-11-178-156.cpe.distributel.net.52947: Flags [P.], seq 14787320:14787556, ack 8965, win 2017, options [nop,nop,TS val 3359244791 ecr 484725352], length 236
22:43:49.488129 IP 165.22.226.250.ssh > 66-11-178-156.cpe.distributel.net.52947: Flags [P.], seq 14787556:14787792, ack 8965, win 2017, options [nop,nop,TS val 3359244791 ecr 484725352], length 236
22:43:49.488220 IP 165.22.226.250.ssh > 66-11-178-156.cpe.distributel.net.52947: Flags [P.], seq 14787792:14788028, ack 8965, win 2017, options [nop,nop,TS val 3359244791 ecr 484725352], length 236
22:43:49.488311 IP 165.22.226.250.ssh > 66-11-178-156.cpe.distributel.net.52947: Flags [P.], seq 14788028:14788264, ack 8965, win 2017, options [nop,nop,TS val 3359244791 ecr 484725352], length 236
22:43:49.488414 IP 165.22.226.250.ssh > 66-11-178-156.cpe.distributel.net.52947: Flags [P.], seq 14788264:14788500, ack 8965, win 2017, options [nop,nop,TS val 3359244792 ecr 484725352], length 236
22:43:49.488520 IP 165.22.226.250.ssh > 66-11-178-156.cpe.distributel.net.52947: Flags [P.], seq 14788500:14788736, ack 8965, win 2017, options [nop,nop,TS val 3359244792 ecr 484725352], length 236
22:43:49.488615 IP 165.22.226.250.ssh > 66-11-178-156.cpe.distributel.net.52947: Flags [P.], seq 14788736:14788972, ack 8965, win 2017, options [nop,nop,TS val 3359244792 ecr 484725352], length 236
22:43:49.488707 IP 165.22.226.250.ssh > 66-11-178-156.cpe.distributel.net.52947: Flags [P.], seq 14788972:14789208, ack 8965, win 2017, options [nop,nop,TS val 3359244792 ecr 484725352], length 236
22:43:49.488789 IP 165.22.226.250.ssh > 66-11-178-156.cpe.distributel.net.52947: Flags [P.], seq 14789208:14789444, ack 8965, win 2017, options [nop,nop,TS val 3359244792 ecr 484725352], length 236
22:43:49.488901 IP 165.22.226.250.ssh > 66-11-178-156.cpe.distributel.net.52947: Flags [P.], seq 14789444:14789680, ack 8965, win 2017, options [nop,nop,TS val 3359244792 ecr 484725352], length 236
22:43:49.488983 IP 165.22.226.250.ssh > 66-11-178-156.cpe.distributel.net.52947: Flags [P.], seq 14789680:14789916, ack 8965, win 2017, options [nop,nop,TS val 3359244792 ecr 484725352], length 236
22:43:49.489068 IP 165.22.226.250.ssh > 66-11-178-156.cpe.distributel.net.52947: Flags [P.], seq 14789916:14790152, ack 8965, win 2017, options [nop,nop,TS val 3359244792 ecr 484725352], length 236
22:43:49.489163 IP 165.22.226.250.ssh > 66-11-178-156.cpe.distributel.net.52947: Flags [P.], seq 14790152:14790388, ack 8965, win 2017, options [nop,nop,TS val 3359244792 ecr 484725352], length 236
22:43:49.489253 IP 165.22.226.250.ssh > 66-11-178-156.cpe.distributel.net.52947: Flags [P.], seq 14790388:14790624, ack 8965, win 2017, options [nop,nop,TS val 3359244792 ecr 484725352], length 236
22:43:49.489338 IP 165.22.226.250.ssh > 66-11-178-156.cpe.distributel.net.52947: Flags [P.], seq 14790624:14790860, ack 8965, win 2017, options [nop,nop,TS val 3359244792 ecr 484725352], length 236
22:43:49.489450 IP 165.22.226.250.ssh > 66-11-178-156.cpe.distributel.net.52947: Flags [P.], seq 14790860:14791096, ack 8965, win 2017, options [nop,nop,TS val 3359244793 ecr 484725352], length 236
22:43:49.489534 IP 165.22.226.250.ssh > 66-11-178-156.cpe.distributel.net.52947: Flags [P.], seq 14791096:14791332, ack 8965, win 2017, options [nop,nop,TS val 3359244793 ecr 484725352], length 236
22:43:49.489635 IP 165.22.226.250.ssh > 66-11-178-156.cpe.distributel.net.52947: Flags [P.], seq 14791332:14791568, ack 8965, win 2017, options [nop,nop,TS val 3359244793 ecr 484725352], length 236
22:43:49.489721 IP 165.22.226.250.ssh > 66-11-178-156.cpe.distributel.net.52947: Flags [P.], seq 14791568:14791804, ack 8965, win 2017, options [nop,nop,TS val 3359244793 ecr 484725352], length 236
22:43:49.489818 IP 165.22.226.250.ssh > 66-11-178-156.cpe.distributel.net.52947: Flags [P.], seq 14791804:14792040, ack 8965, win 2017, options [nop,nop,TS val 3359244793 ecr 484725352], length 236
22:43:49.489916 IP 165.22.226.250.ssh > 66-11-178-156.cpe.distributel.net.52947: Flags [P.], seq 14792040:14792276, ack 8965, win 2017, options [nop,nop,TS val 3359244793 ecr 484725352], length 236
22:43:49.490014 IP 165.22.226.250.ssh > 66-11-178-156.cpe.distributel.net.52947: Flags [P.], seq 14792276:14792512, ack 8965, win 2017, options [nop,nop,TS val 3359244793 ecr 484725352], length 236
22:43:49.490105 IP 165.22.226.250.ssh > 66-11-178-156.cpe.distributel.net.52947: Flags [P.], seq 14792512:14792748, ack 8965, win 2017, options [nop,nop,TS val 3359244793 ecr 484725352], length 236
22:43:49.490197 IP 165.22.226.250.ssh > 66-11-178-156.cpe.distributel.net.52947: Flags [P.], seq 14792748:14792984, ack 8965, win 2017, options [nop,nop,TS val 3359244793 ecr 484725352], length 236
22:43:49.490290 IP 165.22.226.250.ssh > 66-11-178-156.cpe.distributel.net.52947: Flags [P.], seq 14792984:14793220, ack 8965, win 2017, options [nop,nop,TS val 3359244793 ecr 484725352], length 236
22:43:49.490379 IP 165.22.226.250.ssh > 66-11-178-156.cpe.distributel.net.52947: Flags [P.], seq 14793220:14793456, ack 8965, win 2017, options [nop,nop,TS val 3359244793 ecr 484725352], length 236
22:43:49.490466 IP 165.22.226.250.ssh > 66-11-178-156.cpe.distributel.net.52947: Flags [P.], seq 14793456:14793692, ack 8965, win 2017, options [nop,nop,TS val 3359244794 ecr 484725352], length 236
22:43:49.490560 IP 165.22.226.250.ssh > 66-11-178-156.cpe.distributel.net.52947: Flags [P.], seq 14793692:14793928, ack 8965, win 2017, options [nop,nop,TS val 3359244794 ecr 484725352], length 236
22:43:49.490658 IP 165.22.226.250.ssh > 66-11-178-156.cpe.distributel.net.52947: Flags [P.], seq 14793928:14794164, ack 8965, win 2017, options [nop,nop,TS val 3359244794 ecr 484725352], length 236
22:43:49.490768 IP 165.22.226.250.ssh > 66-11-178-156.cpe.distributel.net.52947: Flags [P.], seq 14794164:14794400, ack 8965, win 2017, options [nop,nop,TS val 3359244794 ecr 484725352], length 236
22:43:49.490849 IP 165.22.226.250.ssh > 66-11-178-156.cpe.distributel.net.52947: Flags [P.], seq 14794400:14794636, ack 8965, win 2017, options [nop,nop,TS val 3359244794 ecr 484725352], length 236
22:43:49.490937 IP 165.22.226.250.ssh > 66-11-178-156.cpe.distributel.net.52947: Flags [P.], seq 14794636:14794872, ack 8965, win 2017, options [nop,nop,TS val 3359244794 ecr 484725352], length 236
22:43:49.491022 IP 165.22.226.250.ssh > 66-11-178-156.cpe.distributel.net.52947: Flags [P.], seq 14794872:14795108, ack 8965, win 2017, options [nop,nop,TS val 3359244794 ecr 484725352], length 236
22:43:49.491136 IP 165.22.226.250.ssh > 66-11-178-156.cpe.distributel.net.52947: Flags [P.], seq 14795108:14795344, ack 8965, win 2017, options [nop,nop,TS val 3359244794 ecr 484725352], length 236
22:43:49.491229 IP 165.22.226.250.ssh > 66-11-178-156.cpe.distributel.net.52947: Flags [P.], seq 14795344:14795580, ack 8965, win 2017, options [nop,nop,TS val 3359244794 ecr 484725352], length 236
22:43:49.503477 IP 66-11-178-156.cpe.distributel.net.52947 > 165.22.226.250.ssh: Flags [.], ack 14743932, win 65466, options [nop,nop,TS val 484725367 ecr 3359244629], length 0
22:43:49.503559 IP 165.22.226.250.ssh > 66-11-178-156.cpe.distributel.net.52947: Flags [P.], seq 14795580:14795816, ack 8965, win 2017, options [nop,nop,TS val 3359244807 ecr 484725367], length 236
22:43:49.503872 IP 165.22.226.250.ssh > 66-11-178-156.cpe.distributel.net.52947: Flags [P.], seq 14795816:14796228, ack 8965, win 2017, options [nop,nop,TS val 3359244807 ecr 484725367], length 412
22:43:49.504010 IP 165.22.226.250.ssh > 66-11-178-156.cpe.distributel.net.52947: Flags [P.], seq 14796228:14796464, ack 8965, win 2017, options [nop,nop,TS val 3359244807 ecr 484725367], length 236
22:43:49.509194 IP 66-11-178-156.cpe.distributel.net.52947 > 165.22.226.250.ssh: Flags [.], ack 14743932, win 65535, options [nop,nop,TS val 484725367 ecr 3359244629], length 0
22:43:49.509252 IP 66-11-178-156.cpe.distributel.net.52947 > 165.22.226.250.ssh: Flags [P.], seq 8965:9001, ack 14743932, win 65535, options [nop,nop,TS val 484725367 ecr 3359244629], length 36
22:43:49.509513 IP 165.22.226.250.ssh > 66-11-178-156.cpe.distributel.net.52947: Flags [.], ack 9001, win 2017, options [nop,nop,TS val 3359244813 ecr 484725367], length 0
22:43:49.658316 IP 66-11-178-156.cpe.distributel.net.52947 > 165.22.226.250.ssh: Flags [.], ack 14746716, win 65499, options [nop,nop,TS val 484725384 ecr 3359244630], length 0
22:43:49.658387 IP 165.22.226.250.ssh > 66-11-178-156.cpe.distributel.net.52947: Flags [P.], seq 14796464:14797324, ack 9001, win 2017, options [nop,nop,TS val 3359244961 ecr 484725384], length 860
22:43:49.658647 IP 165.22.226.250.ssh > 66-11-178-156.cpe.distributel.net.52947: Flags [P.], seq 14797324:14797736, ack 9001, win 2017, options [nop,nop,TS val 3359244962 ecr 484725384], length 412
22:43:49.658760 IP 165.22.226.250.ssh > 66-11-178-156.cpe.distributel.net.52947: Flags [P.], seq 14797736:14797972, ack 9001, win 2017, options [nop,nop,TS val 3359244962 ecr 484725384], length 236
22:43:49.658857 IP 165.22.226.250.ssh > 66-11-178-156.cpe.distributel.net.52947: Flags [P.], seq 14797972:14798208, ack 9001, win 2017, options [nop,nop,TS val 3359244962 ecr 484725384], length 236
22:43:49.658936 IP 165.22.226.250.ssh > 66-11-178-156.cpe.distributel.net.52947: Flags [P.], seq 14798208:14798444, ack 9001, win 2017, options [nop,nop,TS val 3359244962 ecr 484725384], length 236
22:43:49.664280 IP 66-11-178-156.cpe.distributel.net.52947 > 165.22.226.250.ssh: Flags [P.], seq 8929:9001, ack 14746716, win 65535, options [nop,nop,TS val 484725504 ecr 3359244630], length 72
22:43:49.664341 IP 165.22.226.250.ssh > 66-11-178-156.cpe.distributel.net.52947: Flags [.], ack 9001, win 2017, options [nop,nop,TS val 3359244967 ecr 484725504,nop,nop,sack 1 {8929:9001}], length 0
22:43:49.669820 IP 66-11-178-156.cpe.distributel.net.52947 > 165.22.226.250.ssh: Flags [.], ack 14747424, win 65523, options [nop,nop,TS val 484725530 ecr 3359244630], length 0
22:43:49.669882 IP 165.22.226.250.ssh > 66-11-178-156.cpe.distributel.net.52947: Flags [P.], seq 14798444:14799116, ack 9001, win 2017, options [nop,nop,TS val 3359244973 ecr 484725530], length 672
22:43:49.670073 IP 165.22.226.250.ssh > 66-11-178-156.cpe.distributel.net.52947: Flags [P.], seq 14799116:14799528, ack 9001, win 2017, options [nop,nop,TS val 3359244973 ecr 484725530], length 412
22:43:49.670165 IP 165.22.226.250.ssh > 66-11-178-156.cpe.distributel.net.52947: Flags [P.], seq 14799528:14799764, ack 9001, win 2017, options [nop,nop,TS val 3359244973 ecr 484725530], length 236
22:43:49.816758 IP 66-11-178-156.cpe.distributel.net.52947 > 165.22.226.250.ssh: Flags [.], ack 14747896, win 65516, options [nop,nop,TS val 484725535 ecr 3359244630], length 0
22:43:49.816845 IP 165.22.226.250.ssh > 66-11-178-156.cpe.distributel.net.52947: Flags [P.], seq 14799764:14800000, ack 9001, win 2017, options [nop,nop,TS val 3359245120 ecr 484725535], length 236
22:43:49.817117 IP 165.22.226.250.ssh > 66-11-178-156.cpe.distributel.net.52947: Flags [P.], seq 14800000:14800412, ack 9001, win 2017, options [nop,nop,TS val 3359245120 ecr 484725535], length 412
22:43:49.847362 IP 66-11-178-156.cpe.distributel.net.52947 > 165.22.226.250.ssh: Flags [.], ack 14749076, win 65499, options [nop,nop,TS val 484725674 ecr 3359244631], length 0
22:43:49.847441 IP 165.22.226.250.ssh > 66-11-178-156.cpe.distributel.net.52947: Flags [P.], seq 14800412:14800648, ack 9001, win 2017, options [nop,nop,TS val 3359245151 ecr 484725674], length 236
22:43:49.847469 IP 66-11-178-156.cpe.distributel.net.52947 > 165.22.226.250.ssh: Flags [.], ack 14750256, win 65499, options [nop,nop,TS val 484725689 ecr 3359244631], length 0
22:43:49.847721 IP 165.22.226.250.ssh > 66-11-178-156.cpe.distributel.net.52947: Flags [P.], seq 14800648:14801244, ack 9001, win 2017, options [nop,nop,TS val 3359245151 ecr 484725689], length 596
22:43:49.847823 IP 165.22.226.250.ssh > 66-11-178-156.cpe.distributel.net.52947: Flags [P.], seq 14801244:14801480, ack 9001, win 2017, options [nop,nop,TS val 3359245151 ecr 484725689], length 236
22:43:49.847912 IP 165.22.226.250.ssh > 66-11-178-156.cpe.distributel.net.52947: Flags [P.], seq 14801480:14801716, ack 9001, win 2017, options [nop,nop,TS val 3359245151 ecr 484725689], length 236
22:43:49.847997 IP 165.22.226.250.ssh > 66-11-178-156.cpe.distributel.net.52947: Flags [P.], seq 14801716:14801952, ack 9001, win 2017, options [nop,nop,TS val 3359245151 ecr 484725689], length 236
22:43:49.848081 IP 165.22.226.250.ssh > 66-11-178-156.cpe.distributel.net.52947: Flags [P.], seq 14801952:14802188, ack 9001, win 2017, options [nop,nop,TS val 3359245151 ecr 484725689], length 236
22:43:49.848170 IP 165.22.226.250.ssh > 66-11-178-156.cpe.distributel.net.52947: Flags [P.], seq 14802188:14802424, ack 9001, win 2017, options [nop,nop,TS val 3359245151 ecr 484725689], length 236
22:43:49.848258 IP 165.22.226.250.ssh > 66-11-178-156.cpe.distributel.net.52947: Flags [P.], seq 14802424:14802660, ack 9001, win 2017, options [nop,nop,TS val 3359245151 ecr 484725689], length 236
22:43:49.848354 IP 165.22.226.250.ssh > 66-11-178-156.cpe.distributel.net.52947: Flags [P.], seq 14802660:14802896, ack 9001, win 2017, options [nop,nop,TS val 3359245151 ecr 484725689], length 236
22:43:49.848440 IP 165.22.226.250.ssh > 66-11-178-156.cpe.distributel.net.52947: Flags [P.], seq 14802896:14803132, ack 9001, win 2017, options [nop,nop,TS val 3359245152 ecr 484725689], length 236
22:43:49.848525 IP 165.22.226.250.ssh > 66-11-178-156.cpe.distributel.net.52947: Flags [P.], seq 14803132:14803368, ack 9001, win 2017, options [nop,nop,TS val 3359245152 ecr 484725689], length 236
22:43:49.850804 IP 66-11-178-156.cpe.distributel.net.52947 > 165.22.226.250.ssh: Flags [.], ack 14751672, win 65499, options [nop,nop,TS val 484725703 ecr 3359244632], length 0
22:43:49.850846 IP 165.22.226.250.ssh > 66-11-178-156.cpe.distributel.net.52947: Flags [P.], seq 14803368:14803604, ack 9001, win 2017, options [nop,nop,TS val 3359245154 ecr 484725703], length 236
22:43:49.850862 IP 66-11-178-156.cpe.distributel.net.52947 > 165.22.226.250.ssh: Flags [.], ack 14751908, win 65499, options [nop,nop,TS val 484725709 ecr 3359244776], length 0
22:43:49.851023 IP 165.22.226.250.ssh > 66-11-178-156.cpe.distributel.net.52947: Flags [P.], seq 14803604:14804200, ack 9001, win 2017, options [nop,nop,TS val 3359245154 ecr 484725709], length 596
22:43:49.851101 IP 165.22.226.250.ssh > 66-11-178-156.cpe.distributel.net.52947: Flags [P.], seq 14804200:14804436, ack 9001, win 2017, options [nop,nop,TS val 3359245154 ecr 484725709], length 236
22:43:49.851164 IP 165.22.226.250.ssh > 66-11-178-156.cpe.distributel.net.52947: Flags [P.], seq 14804436:14804672, ack 9001, win 2017, options [nop,nop,TS val 3359245154 ecr 484725709], length 236
22:43:49.851223 IP 165.22.226.250.ssh > 66-11-178-156.cpe.distributel.net.52947: Flags [P.], seq 14804672:14804908, ack 9001, win 2017, options [nop,nop,TS val 3359245154 ecr 484725709], length 236
22:43:49.851316 IP 165.22.226.250.ssh > 66-11-178-156.cpe.distributel.net.52947: Flags [P.], seq 14804908:14805144, ack 9001, win 2017, options [nop,nop,TS val 3359245154 ecr 484725709], length 236
22:43:49.851538 IP 165.22.226.250.ssh > 66-11-178-156.cpe.distributel.net.52947: Flags [P.], seq 14805144:14805380, ack 9001, win 2017, options [nop,nop,TS val 3359245155 ecr 484725709], length 236
22:43:49.988338 IP 66-11-178-156.cpe.distributel.net.52947 > 165.22.226.250.ssh: Flags [.], ack 14753280, win 65499, options [nop,nop,TS val 484725843 ecr 3359244777], length 0
22:43:49.988412 IP 165.22.226.250.ssh > 66-11-178-156.cpe.distributel.net.52947: Flags [P.], seq 14805380:14805616, ack 9001, win 2017, options [nop,nop,TS val 3359245292 ecr 484725843], length 236
22:43:49.988657 IP 165.22.226.250.ssh > 66-11-178-156.cpe.distributel.net.52947: Flags [P.], seq 14805616:14806028, ack 9001, win 2017, options [nop,nop,TS val 3359245292 ecr 484725843], length 412
22:43:49.988751 IP 165.22.226.250.ssh > 66-11-178-156.cpe.distributel.net.52947: Flags [P.], seq 14806028:14806264, ack 9001, win 2017, options [nop,nop,TS val 3359245292 ecr 484725843], length 236
22:43:49.988888 IP 165.22.226.250.ssh > 66-11-178-156.cpe.distributel.net.52947: Flags [P.], seq 14806264:14806500, ack 9001, win 2017, options [nop,nop,TS val 3359245292 ecr 484725843], length 236
22:43:49.988964 IP 165.22.226.250.ssh > 66-11-178-156.cpe.distributel.net.52947: Flags [P.], seq 14806500:14806736, ack 9001, win 2017, options [nop,nop,TS val 3359245292 ecr 484725843], length 236
22:43:49.989032 IP 165.22.226.250.ssh > 66-11-178-156.cpe.distributel.net.52947: Flags [P.], seq 14806736:14806972, ack 9001, win 2017, options [nop,nop,TS val 3359245292 ecr 484725843], length 236
22:43:49.993686 IP 66-11-178-156.cpe.distributel.net.52947 > 165.22.226.250.ssh: Flags [.], ack 14753516, win 65499, options [nop,nop,TS val 484725844 ecr 3359244777], length 0
22:43:49.993738 IP 165.22.226.250.ssh > 66-11-178-156.cpe.distributel.net.52947: Flags [P.], seq 14806972:14807208, ack 9001, win 2017, options [nop,nop,TS val 3359245297 ecr 484725844], length 236
22:43:50.000617 IP 66-11-178-156.cpe.distributel.net.52947 > 165.22.226.250.ssh: Flags [.], ack 14754460, win 65499, options [nop,nop,TS val 484725851 ecr 3359244777], length 0
22:43:50.000691 IP 165.22.226.250.ssh > 66-11-178-156.cpe.distributel.net.52947: Flags [P.], seq 14807208:14807620, ack 9001, win 2017, options [nop,nop,TS val 3359245304 ecr 484725851], length 412
22:43:50.000952 IP 165.22.226.250.ssh > 66-11-178-156.cpe.distributel.net.52947: Flags [P.], seq 14807620:14808032, ack 9001, win 2017, options [nop,nop,TS val 3359245304 ecr 484725851], length 412
22:43:50.001051 IP 165.22.226.250.ssh > 66-11-178-156.cpe.distributel.net.52947: Flags [P.], seq 14808032:14808268, ack 9001, win 2017, options [nop,nop,TS val 3359245304 ecr 484725851], length 236
22:43:50.001134 IP 165.22.226.250.ssh > 66-11-178-156.cpe.distributel.net.52947: Flags [P.], seq 14808268:14808504, ack 9001, win 2017, options [nop,nop,TS val 3359245304 ecr 484725851], length 236
22:43:50.009497 IP 66-11-178-156.cpe.distributel.net.52947 > 165.22.226.250.ssh: Flags [.], ack 14754932, win 65499, options [nop,nop,TS val 484725854 ecr 3359244777], length 0
22:43:50.009557 IP 165.22.226.250.ssh > 66-11-178-156.cpe.distributel.net.52947: Flags [P.], seq 14808504:14808740, ack 9001, win 2017, options [nop,nop,TS val 3359245313 ecr 484725854], length 236
22:43:50.009758 IP 165.22.226.250.ssh > 66-11-178-156.cpe.distributel.net.52947: Flags [P.], seq 14808740:14809152, ack 9001, win 2017, options [nop,nop,TS val 3359245313 ecr 484725854], length 412
22:43:50.159315 IP 66-11-178-156.cpe.distributel.net.52947 > 165.22.226.250.ssh: Flags [.], ack 14756112, win 65499, options [nop,nop,TS val 484725863 ecr 3359244778], length 0
22:43:50.159402 IP 165.22.226.250.ssh > 66-11-178-156.cpe.distributel.net.52947: Flags [P.], seq 14809152:14809388, ack 9001, win 2017, options [nop,nop,TS val 3359245462 ecr 484725863], length 236
22:43:50.159673 IP 165.22.226.250.ssh > 66-11-178-156.cpe.distributel.net.52947: Flags [P.], seq 14809388:14809800, ack 9001, win 2017, options [nop,nop,TS val 3359245463 ecr 484725863], length 412
22:43:50.159779 IP 165.22.226.250.ssh > 66-11-178-156.cpe.distributel.net.52947: Flags [P.], seq 14809800:14810036, ack 9001, win 2017, options [nop,nop,TS val 3359245463 ecr 484725863], length 236
22:43:50.159850 IP 165.22.226.250.ssh > 66-11-178-156.cpe.distributel.net.52947: Flags [P.], seq 14810036:14810272, ack 9001, win 2017, options [nop,nop,TS val 3359245463 ecr 484725863], length 236
22:43:50.159919 IP 165.22.226.250.ssh > 66-11-178-156.cpe.distributel.net.52947: Flags [P.], seq 14810272:14810508, ack 9001, win 2017, options [nop,nop,TS val 3359245463 ecr 484725863], length 236
22:43:50.159989 IP 165.22.226.250.ssh > 66-11-178-156.cpe.distributel.net.52947: Flags [P.], seq 14810508:14810744, ack 9001, win 2017, options [nop,nop,TS val 3359245463 ecr 484725863], length 236
22:43:50.163445 IP 66-11-178-156.cpe.distributel.net.52947 > 165.22.226.250.ssh: Flags [.], ack 14757528, win 65499, options [nop,nop,TS val 484725869 ecr 3359244778], length 0
22:43:50.163489 IP 165.22.226.250.ssh > 66-11-178-156.cpe.distributel.net.52947: Flags [P.], seq 14810744:14810980, ack 9001, win 2017, options [nop,nop,TS val 3359245467 ecr 484725869], length 236
22:43:50.163504 IP 66-11-178-156.cpe.distributel.net.52947 > 165.22.226.250.ssh: Flags [.], ack 14758944, win 65491, options [nop,nop,TS val 484726010 ecr 3359244779], length 0
22:43:50.163695 IP 165.22.226.250.ssh > 66-11-178-156.cpe.distributel.net.52947: Flags [P.], seq 14810980:14811576, ack 9001, win 2017, options [nop,nop,TS val 3359245467 ecr 484726010], length 596
22:43:50.163765 IP 165.22.226.250.ssh > 66-11-178-156.cpe.distributel.net.52947: Flags [P.], seq 14811576:14811812, ack 9001, win 2017, options [nop,nop,TS val 3359245467 ecr 484726010], length 236
22:43:50.163838 IP 165.22.226.250.ssh > 66-11-178-156.cpe.distributel.net.52947: Flags [P.], seq 14811812:14812048, ack 9001, win 2017, options [nop,nop,TS val 3359245467 ecr 484726010], length 236
22:43:50.163933 IP 165.22.226.250.ssh > 66-11-178-156.cpe.distributel.net.52947: Flags [P.], seq 14812048:14812284, ack 9001, win 2017, options [nop,nop,TS val 3359245467 ecr 484726010], length 236
22:43:50.164004 IP 165.22.226.250.ssh > 66-11-178-156.cpe.distributel.net.52947: Flags [P.], seq 14812284:14812520, ack 9001, win 2017, options [nop,nop,TS val 3359245467 ecr 484726010], length 236
22:43:50.164064 IP 165.22.226.250.ssh > 66-11-178-156.cpe.distributel.net.52947: Flags [P.], seq 14812520:14812756, ack 9001, win 2017, options [nop,nop,TS val 3359245467 ecr 484726010], length 236
22:43:50.164135 IP 165.22.226.250.ssh > 66-11-178-156.cpe.distributel.net.52947: Flags [P.], seq 14812756:14812992, ack 9001, win 2017, options [nop,nop,TS val 3359245467 ecr 484726010], length 236
22:43:50.164249 IP 165.22.226.250.ssh > 66-11-178-156.cpe.distributel.net.52947: Flags [P.], seq 14812992:14813228, ack 9001, win 2017, options [nop,nop,TS val 3359245467 ecr 484726010], length 236
22:43:50.164334 IP 165.22.226.250.ssh > 66-11-178-156.cpe.distributel.net.52947: Flags [P.], seq 14813228:14813464, ack 9001, win 2017, options [nop,nop,TS val 3359245467 ecr 484726010], length 236
22:43:50.164421 IP 165.22.226.250.ssh > 66-11-178-156.cpe.distributel.net.52947: Flags [P.], seq 14813464:14813700, ack 9001, win 2017, options [nop,nop,TS val 3359245468 ecr 484726010], length 236
22:43:50.164511 IP 165.22.226.250.ssh > 66-11-178-156.cpe.distributel.net.52947: Flags [P.], seq 14813700:14813936, ack 9001, win 2017, options [nop,nop,TS val 3359245468 ecr 484726010], length 236
22:43:50.169745 IP 66-11-178-156.cpe.distributel.net.52947 > 165.22.226.250.ssh: Flags [.], ack 14759180, win 65499, options [nop,nop,TS val 484726013 ecr 3359244779], length 0
22:43:50.169797 IP 165.22.226.250.ssh > 66-11-178-156.cpe.distributel.net.52947: Flags [P.], seq 14813936:14814172, ack 9001, win 2017, options [nop,nop,TS val 3359245473 ecr 484726013], length 236
22:43:50.180656 IP 66-11-178-156.cpe.distributel.net.52947 > 165.22.226.250.ssh: Flags [.], ack 14759888, win 65499, options [nop,nop,TS val 484726025 ecr 3359244779], length 0
22:43:50.180719 IP 165.22.226.250.ssh > 66-11-178-156.cpe.distributel.net.52947: Flags [P.], seq 14814172:14814584, ack 9001, win 2017, options [nop,nop,TS val 3359245484 ecr 484726025], length 412
22:43:50.180958 IP 165.22.226.250.ssh > 66-11-178-156.cpe.distributel.net.52947: Flags [P.], seq 14814584:14814996, ack 9001, win 2017, options [nop,nop,TS val 3359245484 ecr 484726025], length 412
22:43:50.181044 IP 165.22.226.250.ssh > 66-11-178-156.cpe.distributel.net.52947: Flags [P.], seq 14814996:14815232, ack 9001, win 2017, options [nop,nop,TS val 3359245484 ecr 484726025], length 236
22:43:50.181105 IP 165.22.226.250.ssh > 66-11-178-156.cpe.distributel.net.52947: Flags [P.], seq 14815232:14815468, ack 9001, win 2017, options [nop,nop,TS val 3359245484 ecr 484726025], length 236
22:43:50.193673 IP 66-11-178-156.cpe.distributel.net.52947 > 165.22.226.250.ssh: Flags [.], ack 14760360, win 65499, options [nop,nop,TS val 484726033 ecr 3359244780], length 0
22:43:50.193739 IP 165.22.226.250.ssh > 66-11-178-156.cpe.distributel.net.52947: Flags [P.], seq 14815468:14815704, ack 9001, win 2017, options [nop,nop,TS val 3359245497 ecr 484726033], length 236
22:43:50.194036 IP 165.22.226.250.ssh > 66-11-178-156.cpe.distributel.net.52947: Flags [P.], seq 14815704:14816116, ack 9001, win 2017, options [nop,nop,TS val 3359245497 ecr 484726033], length 412
22:43:50.209532 IP 66-11-178-156.cpe.distributel.net.52947 > 165.22.226.250.ssh: Flags [.], ack 14760832, win 65499, options [nop,nop,TS val 484726041 ecr 3359244780], length 0
22:43:50.209601 IP 165.22.226.250.ssh > 66-11-178-156.cpe.distributel.net.52947: Flags [P.], seq 14816116:14816352, ack 9001, win 2017, options [nop,nop,TS val 3359245513 ecr 484726041], length 236
22:43:50.209835 IP 165.22.226.250.ssh > 66-11-178-156.cpe.distributel.net.52947: Flags [P.], seq 14816352:14816764, ack 9001, win 2017, options [nop,nop,TS val 3359245513 ecr 484726041], length 412
22:43:50.349718 IP 66-11-178-156.cpe.distributel.net.52947 > 165.22.226.250.ssh: Flags [.], ack 14761304, win 65499, options [nop,nop,TS val 484726050 ecr 3359244780], length 0
22:43:50.349798 IP 165.22.226.250.ssh > 66-11-178-156.cpe.distributel.net.52947: Flags [P.], seq 14816764:14817000, ack 9001, win 2017, options [nop,nop,TS val 3359245653 ecr 484726050], length 236
22:43:50.350057 IP 165.22.226.250.ssh > 66-11-178-156.cpe.distributel.net.52947: Flags [P.], seq 14817000:14817412, ack 9001, win 2017, options [nop,nop,TS val 3359245653 ecr 484726050], length 412
22:43:50.355948 IP 66-11-178-156.cpe.distributel.net.52947 > 165.22.226.250.ssh: Flags [.], ack 14762484, win 65499, options [nop,nop,TS val 484726201 ecr 3359244780], length 0
22:43:50.356007 IP 165.22.226.250.ssh > 66-11-178-156.cpe.distributel.net.52947: Flags [P.], seq 14817412:14817648, ack 9001, win 2017, options [nop,nop,TS val 3359245659 ecr 484726201], length 236
22:43:50.356191 IP 165.22.226.250.ssh > 66-11-178-156.cpe.distributel.net.52947: Flags [P.], seq 14817648:14817860, ack 9001, win 2017, options [nop,nop,TS val 3359245659 ecr 484726201], length 212
22:43:50.356295 IP 165.22.226.250.ssh > 66-11-178-156.cpe.distributel.net.52947: Flags [P.], seq 14817860:14818296, ack 9001, win 2017, options [nop,nop,TS val 3359245659 ecr 484726201], length 436
22:43:50.356377 IP 165.22.226.250.ssh > 66-11-178-156.cpe.distributel.net.52947: Flags [P.], seq 14818296:14818532, ack 9001, win 2017, options [nop,nop,TS val 3359245659 ecr 484726201], length 236
22:43:50.356451 IP 165.22.226.250.ssh > 66-11-178-156.cpe.distributel.net.52947: Flags [P.], seq 14818532:14818768, ack 9001, win 2017, options [nop,nop,TS val 3359245660 ecr 484726201], length 236
22:43:50.356525 IP 165.22.226.250.ssh > 66-11-178-156.cpe.distributel.net.52947: Flags [P.], seq 14818768:14819004, ack 9001, win 2017, options [nop,nop,TS val 3359245660 ecr 484726201], length 236
22:43:50.366733 IP 66-11-178-156.cpe.distributel.net.52947 > 165.22.226.250.ssh: Flags [.], ack 14762720, win 65499, options [nop,nop,TS val 484726207 ecr 3359244781], length 0
22:43:50.366803 IP 165.22.226.250.ssh > 66-11-178-156.cpe.distributel.net.52947: Flags [P.], seq 14819004:14819240, ack 9001, win 2017, options [nop,nop,TS val 3359245670 ecr 484726207], length 236
22:43:50.380912 IP 66-11-178-156.cpe.distributel.net.52947 > 165.22.226.250.ssh: Flags [.], ack 14762956, win 65499, options [nop,nop,TS val 484726220 ecr 3359244781], length 0
22:43:50.380991 IP 165.22.226.250.ssh > 66-11-178-156.cpe.distributel.net.52947: Flags [P.], seq 14819240:14819724, ack 9001, win 2017, options [nop,nop,TS val 3359245684 ecr 484726220], length 484
22:43:50.447034 IP 165.22.226.250.ssh > 49.88.211.88.48753: Flags [F.], seq 1, ack 0, win 507, options [nop,nop,TS val 2948075044 ecr 2410191807], length 0
22:43:50.522399 IP 66-11-178-156.cpe.distributel.net.52947 > 165.22.226.250.ssh: Flags [P.], seq 8965:9001, ack 14762956, win 65535, options [nop,nop,TS val 484726347 ecr 3359244781], length 36
22:43:50.522465 IP 165.22.226.250.ssh > 66-11-178-156.cpe.distributel.net.52947: Flags [.], ack 9001, win 2017, options [nop,nop,TS val 3359245826 ecr 484726347,nop,nop,sack 1 {8965:9001}], length 0
22:43:50.528145 IP 66-11-178-156.cpe.distributel.net.52947 > 165.22.226.250.ssh: Flags [.], ack 14763192, win 65531, options [nop,nop,TS val 484726365 ecr 3359244781], length 0
22:43:50.528276 IP 165.22.226.250.ssh > 66-11-178-156.cpe.distributel.net.52947: Flags [P.], seq 14819724:14821012, ack 9001, win 2017, options [nop,nop,TS val 3359245831 ecr 484726365], length 1288
22:43:50.538075 IP 66-11-178-156.cpe.distributel.net.52947 > 165.22.226.250.ssh: Flags [.], ack 14763428, win 65527, options [nop,nop,TS val 484726373 ecr 3359244781], length 0
22:43:50.538145 IP 165.22.226.250.ssh > 66-11-178-156.cpe.distributel.net.52947: Flags [P.], seq 14821012:14821532, ack 9001, win 2017, options [nop,nop,TS val 3359245841 ecr 484726373], length 520
22:43:51.041267 IP 66-11-178-156.cpe.distributel.net.52947 > 165.22.226.250.ssh: Flags [.], ack 14763664, win 65523, options [nop,nop,TS val 484726876 ecr 3359244781], length 0
22:43:51.041331 IP 165.22.226.250.ssh > 66-11-178-156.cpe.distributel.net.52947: Flags [P.], seq 14821532:14822052, ack 9001, win 2017, options [nop,nop,TS val 3359246344 ecr 484726876], length 520
22:43:51.057089 IP 66-11-178-156.cpe.distributel.net.52947 > 165.22.226.250.ssh: Flags [.], ack 14764228, win 65515, options [nop,nop,TS val 484726891 ecr 3359244781], length 0
22:43:51.057162 IP 165.22.226.250.ssh > 66-11-178-156.cpe.distributel.net.52947: Flags [P.], seq 14822052:14822572, ack 9001, win 2017, options [nop,nop,TS val 3359246360 ecr 484726891], length 520
22:43:51.092714 IP 66-11-178-156.cpe.distributel.net.52947 > 165.22.226.250.ssh: Flags [.], ack 14764664, win 65508, options [nop,nop,TS val 484726922 ecr 3359244781], length 0
22:43:51.092778 IP 165.22.226.250.ssh > 66-11-178-156.cpe.distributel.net.52947: Flags [P.], seq 14822572:14823092, ack 9001, win 2017, options [nop,nop,TS val 3359246396 ecr 484726922], length 520
22:43:51.092952 IP 165.22.226.250.ssh > 66-11-178-156.cpe.distributel.net.52947: Flags [P.], seq 14823092:14823304, ack 9001, win 2017, options [nop,nop,TS val 3359246396 ecr 484726922], length 212
22:43:51.236673 IP 66-11-178-156.cpe.distributel.net.52947 > 165.22.226.250.ssh: Flags [.], ack 14764900, win 65504, options [nop,nop,TS val 484727065 ecr 3359244781], length 0
22:43:51.236735 IP 165.22.226.250.ssh > 66-11-178-156.cpe.distributel.net.52947: Flags [P.], seq 14823304:14823884, ack 9001, win 2017, options [nop,nop,TS val 3359246540 ecr 484727065], length 580
22:43:51.259341 IP 66-11-178-156.cpe.distributel.net.52947 > 165.22.226.250.ssh: Flags [.], ack 14765136, win 65500, options [nop,nop,TS val 484727093 ecr 3359244782], length 0
22:43:51.259417 IP 165.22.226.250.ssh > 66-11-178-156.cpe.distributel.net.52947: Flags [P.], seq 14823884:14824404, ack 9001, win 2017, options [nop,nop,TS val 3359246563 ecr 484727093], length 520
22:43:51.411597 IP 66-11-178-156.cpe.distributel.net.52947 > 165.22.226.250.ssh: Flags [.], ack 14765608, win 65499, options [nop,nop,TS val 484727241 ecr 3359244782], length 0
22:43:51.411668 IP 165.22.226.250.ssh > 66-11-178-156.cpe.distributel.net.52947: Flags [P.], seq 14824404:14824924, ack 9001, win 2017, options [nop,nop,TS val 3359246715 ecr 484727241], length 520
22:43:51.411685 IP 66-11-178-156.cpe.distributel.net.52947 > 165.22.226.250.ssh: Flags [.], ack 14766316, win 65499, options [nop,nop,TS val 484727244 ecr 3359244782], length 0
22:43:51.411884 IP 165.22.226.250.ssh > 66-11-178-156.cpe.distributel.net.52947: Flags [P.], seq 14824924:14825136, ack 9001, win 2017, options [nop,nop,TS val 3359246715 ecr 484727244], length 212
22:43:51.411945 IP 165.22.226.250.ssh > 66-11-178-156.cpe.distributel.net.52947: Flags [P.], seq 14825136:14825172, ack 9001, win 2017, options [nop,nop,TS val 3359246715 ecr 484727244], length 36
22:43:51.412011 IP 165.22.226.250.ssh > 66-11-178-156.cpe.distributel.net.52947: Flags [P.], seq 14825172:14825408, ack 9001, win 2017, options [nop,nop,TS val 3359246715 ecr 484727244], length 236
22:43:51.412052 IP 165.22.226.250.ssh > 66-11-178-156.cpe.distributel.net.52947: Flags [P.], seq 14825408:14825444, ack 9001, win 2017, options [nop,nop,TS val 3359246715 ecr 484727244], length 36
22:43:51.412104 IP 165.22.226.250.ssh > 66-11-178-156.cpe.distributel.net.52947: Flags [P.], seq 14825444:14825656, ack 9001, win 2017, options [nop,nop,TS val 3359246715 ecr 484727244], length 212
22:43:51.417503 IP 66-11-178-156.cpe.distributel.net.52947 > 165.22.226.250.ssh: Flags [.], ack 14767024, win 65499, options [nop,nop,TS val 484727247 ecr 3359244782], length 0
22:43:51.417569 IP 165.22.226.250.ssh > 66-11-178-156.cpe.distributel.net.52947: Flags [P.], seq 14825656:14827052, ack 9001, win 2017, options [nop,nop,TS val 3359246721 ecr 484727247], length 1396
22:43:51.417780 IP 165.22.226.250.ssh > 66-11-178-156.cpe.distributel.net.52947: Flags [P.], seq 14827052:14827264, ack 9001, win 2017, options [nop,nop,TS val 3359246721 ecr 484727247], length 212
22:43:51.417837 IP 165.22.226.250.ssh > 66-11-178-156.cpe.distributel.net.52947: Flags [P.], seq 14827264:14827300, ack 9001, win 2017, options [nop,nop,TS val 3359246721 ecr 484727247], length 36
22:43:51.421795 IP 66-11-178-156.cpe.distributel.net.52947 > 165.22.226.250.ssh: Flags [.], ack 14767260, win 65499, options [nop,nop,TS val 484727248 ecr 3359244783], length 0
22:43:51.421838 IP 165.22.226.250.ssh > 66-11-178-156.cpe.distributel.net.52947: Flags [P.], seq 14827300:14828116, ack 9001, win 2017, options [nop,nop,TS val 3359246725 ecr 484727248], length 816
22:43:51.426523 IP 66-11-178-156.cpe.distributel.net.52947 > 165.22.226.250.ssh: Flags [.], ack 14768204, win 65499, options [nop,nop,TS val 484727252 ecr 3359244783], length 0
22:43:51.426602 IP 165.22.226.250.ssh > 66-11-178-156.cpe.distributel.net.52947: Flags [P.], seq 14828116:14828636, ack 9001, win 2017, options [nop,nop,TS val 3359246730 ecr 484727252], length 520
22:43:51.426801 IP 165.22.226.250.ssh > 66-11-178-156.cpe.distributel.net.52947: Flags [P.], seq 14828636:14828848, ack 9001, win 2017, options [nop,nop,TS val 3359246730 ecr 484727252], length 212
22:43:51.426873 IP 165.22.226.250.ssh > 66-11-178-156.cpe.distributel.net.52947: Flags [P.], seq 14828848:14828884, ack 9001, win 2017, options [nop,nop,TS val 3359246730 ecr 484727252], length 36
22:43:51.426942 IP 165.22.226.250.ssh > 66-11-178-156.cpe.distributel.net.52947: Flags [P.], seq 14828884:14829120, ack 9001, win 2017, options [nop,nop,TS val 3359246730 ecr 484727252], length 236
22:43:51.426999 IP 165.22.226.250.ssh > 66-11-178-156.cpe.distributel.net.52947: Flags [P.], seq 14829120:14829156, ack 9001, win 2017, options [nop,nop,TS val 3359246730 ecr 484727252], length 3