l 3359277598 ecr 484756825], length 236
22:44:22.294956 IP 165.22.226.250.ssh > 66-11-178-156.cpe.distributel.net.52947: Flags [P.], seq 7695992:7696228, ack 4645, win 2017, options [nop,nop,TS val 3359277598 ecr 484756825], length 236
22:44:22.295028 IP 165.22.226.250.ssh > 66-11-178-156.cpe.distributel.net.52947: Flags [P.], seq 7696228:7696464, ack 4645, win 2017, options [nop,nop,TS val 3359277598 ecr 484756825], length 236
22:44:22.295117 IP 165.22.226.250.ssh > 66-11-178-156.cpe.distributel.net.52947: Flags [P.], seq 7696464:7696700, ack 4645, win 2017, options [nop,nop,TS val 3359277598 ecr 484756825], length 236
22:44:22.295210 IP 165.22.226.250.ssh > 66-11-178-156.cpe.distributel.net.52947: Flags [P.], seq 7696700:7696936, ack 4645, win 2017, options [nop,nop,TS val 3359277598 ecr 484756825], length 236
22:44:22.295283 IP 165.22.226.250.ssh > 66-11-178-156.cpe.distributel.net.52947: Flags [P.], seq 7696936:7697172, ack 4645, win 2017, options [nop,nop,TS val 3359277598 ecr 484756825], length 236
22:44:22.295356 IP 165.22.226.250.ssh > 66-11-178-156.cpe.distributel.net.52947: Flags [P.], seq 7697172:7697408, ack 4645, win 2017, options [nop,nop,TS val 3359277598 ecr 484756825], length 236
22:44:22.295418 IP 165.22.226.250.ssh > 66-11-178-156.cpe.distributel.net.52947: Flags [P.], seq 7697408:7697644, ack 4645, win 2017, options [nop,nop,TS val 3359277599 ecr 484756825], length 236
22:44:22.295487 IP 165.22.226.250.ssh > 66-11-178-156.cpe.distributel.net.52947: Flags [P.], seq 7697644:7697880, ack 4645, win 2017, options [nop,nop,TS val 3359277599 ecr 484756825], length 236
22:44:22.295555 IP 165.22.226.250.ssh > 66-11-178-156.cpe.distributel.net.52947: Flags [P.], seq 7697880:7698116, ack 4645, win 2017, options [nop,nop,TS val 3359277599 ecr 484756825], length 236
22:44:22.295614 IP 165.22.226.250.ssh > 66-11-178-156.cpe.distributel.net.52947: Flags [P.], seq 7698116:7698352, ack 4645, win 2017, options [nop,nop,TS val 3359277599 ecr 484756825], length 236
22:44:22.295669 IP 165.22.226.250.ssh > 66-11-178-156.cpe.distributel.net.52947: Flags [P.], seq 7698352:7698588, ack 4645, win 2017, options [nop,nop,TS val 3359277599 ecr 484756825], length 236
22:44:22.295783 IP 165.22.226.250.ssh > 66-11-178-156.cpe.distributel.net.52947: Flags [P.], seq 7698588:7698824, ack 4645, win 2017, options [nop,nop,TS val 3359277599 ecr 484756825], length 236
22:44:22.295877 IP 165.22.226.250.ssh > 66-11-178-156.cpe.distributel.net.52947: Flags [P.], seq 7698824:7699060, ack 4645, win 2017, options [nop,nop,TS val 3359277599 ecr 484756825], length 236
22:44:22.295964 IP 165.22.226.250.ssh > 66-11-178-156.cpe.distributel.net.52947: Flags [P.], seq 7699060:7699296, ack 4645, win 2017, options [nop,nop,TS val 3359277599 ecr 484756825], length 236
22:44:22.296059 IP 165.22.226.250.ssh > 66-11-178-156.cpe.distributel.net.52947: Flags [P.], seq 7699296:7699532, ack 4645, win 2017, options [nop,nop,TS val 3359277599 ecr 484756825], length 236
22:44:22.296153 IP 165.22.226.250.ssh > 66-11-178-156.cpe.distributel.net.52947: Flags [P.], seq 7699532:7699768, ack 4645, win 2017, options [nop,nop,TS val 3359277599 ecr 484756825], length 236
22:44:22.296269 IP 165.22.226.250.ssh > 66-11-178-156.cpe.distributel.net.52947: Flags [P.], seq 7699768:7700004, ack 4645, win 2017, options [nop,nop,TS val 3359277599 ecr 484756825], length 236
22:44:22.296363 IP 165.22.226.250.ssh > 66-11-178-156.cpe.distributel.net.52947: Flags [P.], seq 7700004:7700240, ack 4645, win 2017, options [nop,nop,TS val 3359277599 ecr 484756825], length 236
22:44:22.296428 IP 165.22.226.250.ssh > 66-11-178-156.cpe.distributel.net.52947: Flags [P.], seq 7700240:7700476, ack 4645, win 2017, options [nop,nop,TS val 3359277600 ecr 484756825], length 236
22:44:22.296506 IP 165.22.226.250.ssh > 66-11-178-156.cpe.distributel.net.52947: Flags [P.], seq 7700476:7700712, ack 4645, win 2017, options [nop,nop,TS val 3359277600 ecr 484756825], length 236
22:44:22.296584 IP 165.22.226.250.ssh > 66-11-178-156.cpe.distributel.net.52947: Flags [P.], seq 7700712:7700948, ack 4645, win 2017, options [nop,nop,TS val 3359277600 ecr 484756825], length 236
22:44:22.296666 IP 165.22.226.250.ssh > 66-11-178-156.cpe.distributel.net.52947: Flags [P.], seq 7700948:7701184, ack 4645, win 2017, options [nop,nop,TS val 3359277600 ecr 484756825], length 236
22:44:22.296764 IP 165.22.226.250.ssh > 66-11-178-156.cpe.distributel.net.52947: Flags [P.], seq 7701184:7701420, ack 4645, win 2017, options [nop,nop,TS val 3359277600 ecr 484756825], length 236
22:44:22.296884 IP 165.22.226.250.ssh > 66-11-178-156.cpe.distributel.net.52947: Flags [P.], seq 7701420:7701656, ack 4645, win 2017, options [nop,nop,TS val 3359277600 ecr 484756825], length 236
22:44:22.296977 IP 165.22.226.250.ssh > 66-11-178-156.cpe.distributel.net.52947: Flags [P.], seq 7701656:7701892, ack 4645, win 2017, options [nop,nop,TS val 3359277600 ecr 484756825], length 236
22:44:22.297041 IP 165.22.226.250.ssh > 66-11-178-156.cpe.distributel.net.52947: Flags [P.], seq 7701892:7702128, ack 4645, win 2017, options [nop,nop,TS val 3359277600 ecr 484756825], length 236
22:44:22.297108 IP 165.22.226.250.ssh > 66-11-178-156.cpe.distributel.net.52947: Flags [P.], seq 7702128:7702364, ack 4645, win 2017, options [nop,nop,TS val 3359277600 ecr 484756825], length 236
22:44:22.297209 IP 165.22.226.250.ssh > 66-11-178-156.cpe.distributel.net.52947: Flags [P.], seq 7702364:7702600, ack 4645, win 2017, options [nop,nop,TS val 3359277600 ecr 484756825], length 236
22:44:22.297275 IP 165.22.226.250.ssh > 66-11-178-156.cpe.distributel.net.52947: Flags [P.], seq 7702600:7702836, ack 4645, win 2017, options [nop,nop,TS val 3359277600 ecr 484756825], length 236
22:44:22.297334 IP 165.22.226.250.ssh > 66-11-178-156.cpe.distributel.net.52947: Flags [P.], seq 7702836:7703072, ack 4645, win 2017, options [nop,nop,TS val 3359277600 ecr 484756825], length 236
22:44:22.297526 IP 165.22.226.250.ssh > 66-11-178-156.cpe.distributel.net.52947: Flags [P.], seq 7703072:7703308, ack 4645, win 2017, options [nop,nop,TS val 3359277601 ecr 484756825], length 236
22:44:22.297630 IP 165.22.226.250.ssh > 66-11-178-156.cpe.distributel.net.52947: Flags [P.], seq 7703308:7703544, ack 4645, win 2017, options [nop,nop,TS val 3359277601 ecr 484756825], length 236
22:44:22.297722 IP 165.22.226.250.ssh > 66-11-178-156.cpe.distributel.net.52947: Flags [P.], seq 7703544:7703780, ack 4645, win 2017, options [nop,nop,TS val 3359277601 ecr 484756825], length 236
22:44:22.297823 IP 165.22.226.250.ssh > 66-11-178-156.cpe.distributel.net.52947: Flags [P.], seq 7703780:7704016, ack 4645, win 2017, options [nop,nop,TS val 3359277601 ecr 484756825], length 236
22:44:22.297907 IP 165.22.226.250.ssh > 66-11-178-156.cpe.distributel.net.52947: Flags [P.], seq 7704016:7704252, ack 4645, win 2017, options [nop,nop,TS val 3359277601 ecr 484756825], length 236
22:44:22.297997 IP 165.22.226.250.ssh > 66-11-178-156.cpe.distributel.net.52947: Flags [P.], seq 7704252:7704488, ack 4645, win 2017, options [nop,nop,TS val 3359277601 ecr 484756825], length 236
22:44:22.298086 IP 165.22.226.250.ssh > 66-11-178-156.cpe.distributel.net.52947: Flags [P.], seq 7704488:7704724, ack 4645, win 2017, options [nop,nop,TS val 3359277601 ecr 484756825], length 236
22:44:22.298162 IP 165.22.226.250.ssh > 66-11-178-156.cpe.distributel.net.52947: Flags [P.], seq 7704724:7704960, ack 4645, win 2017, options [nop,nop,TS val 3359277601 ecr 484756825], length 236
22:44:22.298242 IP 165.22.226.250.ssh > 66-11-178-156.cpe.distributel.net.52947: Flags [P.], seq 7704960:7705196, ack 4645, win 2017, options [nop,nop,TS val 3359277601 ecr 484756825], length 236
22:44:22.298336 IP 165.22.226.250.ssh > 66-11-178-156.cpe.distributel.net.52947: Flags [P.], seq 7705196:7705432, ack 4645, win 2017, options [nop,nop,TS val 3359277601 ecr 484756825], length 236
22:44:22.298410 IP 165.22.226.250.ssh > 66-11-178-156.cpe.distributel.net.52947: Flags [P.], seq 7705432:7705668, ack 4645, win 2017, options [nop,nop,TS val 3359277602 ecr 484756825], length 236
22:44:22.298466 IP 165.22.226.250.ssh > 66-11-178-156.cpe.distributel.net.52947: Flags [P.], seq 7705668:7705904, ack 4645, win 2017, options [nop,nop,TS val 3359277602 ecr 484756825], length 236
22:44:22.298523 IP 165.22.226.250.ssh > 66-11-178-156.cpe.distributel.net.52947: Flags [P.], seq 7705904:7706140, ack 4645, win 2017, options [nop,nop,TS val 3359277602 ecr 484756825], length 236
22:44:22.298585 IP 165.22.226.250.ssh > 66-11-178-156.cpe.distributel.net.52947: Flags [P.], seq 7706140:7706376, ack 4645, win 2017, options [nop,nop,TS val 3359277602 ecr 484756825], length 236
22:44:22.298671 IP 165.22.226.250.ssh > 66-11-178-156.cpe.distributel.net.52947: Flags [P.], seq 7706376:7706612, ack 4645, win 2017, options [nop,nop,TS val 3359277602 ecr 484756825], length 236
22:44:22.298757 IP 165.22.226.250.ssh > 66-11-178-156.cpe.distributel.net.52947: Flags [P.], seq 7706612:7706848, ack 4645, win 2017, options [nop,nop,TS val 3359277602 ecr 484756825], length 236
22:44:22.298821 IP 165.22.226.250.ssh > 66-11-178-156.cpe.distributel.net.52947: Flags [P.], seq 7706848:7707084, ack 4645, win 2017, options [nop,nop,TS val 3359277602 ecr 484756825], length 236
22:44:22.298879 IP 165.22.226.250.ssh > 66-11-178-156.cpe.distributel.net.52947: Flags [P.], seq 7707084:7707320, ack 4645, win 2017, options [nop,nop,TS val 3359277602 ecr 484756825], length 236
22:44:22.298956 IP 165.22.226.250.ssh > 66-11-178-156.cpe.distributel.net.52947: Flags [P.], seq 7707320:7707556, ack 4645, win 2017, options [nop,nop,TS val 3359277602 ecr 484756825], length 236
22:44:22.299023 IP 165.22.226.250.ssh > 66-11-178-156.cpe.distributel.net.52947: Flags [P.], seq 7707556:7707792, ack 4645, win 2017, options [nop,nop,TS val 3359277602 ecr 484756825], length 236
22:44:22.299083 IP 165.22.226.250.ssh > 66-11-178-156.cpe.distributel.net.52947: Flags [P.], seq 7707792:7708028, ack 4645, win 2017, options [nop,nop,TS val 3359277602 ecr 484756825], length 236
22:44:22.299144 IP 165.22.226.250.ssh > 66-11-178-156.cpe.distributel.net.52947: Flags [P.], seq 7708028:7708264, ack 4645, win 2017, options [nop,nop,TS val 3359277602 ecr 484756825], length 236
22:44:22.299215 IP 165.22.226.250.ssh > 66-11-178-156.cpe.distributel.net.52947: Flags [P.], seq 7708264:7708500, ack 4645, win 2017, options [nop,nop,TS val 3359277602 ecr 484756825], length 236
22:44:22.299307 IP 165.22.226.250.ssh > 66-11-178-156.cpe.distributel.net.52947: Flags [P.], seq 7708500:7708736, ack 4645, win 2017, options [nop,nop,TS val 3359277602 ecr 484756825], length 236
22:44:22.299419 IP 165.22.226.250.ssh > 66-11-178-156.cpe.distributel.net.52947: Flags [P.], seq 7708736:7708972, ack 4645, win 2017, options [nop,nop,TS val 3359277603 ecr 484756825], length 236
22:44:22.299515 IP 165.22.226.250.ssh > 66-11-178-156.cpe.distributel.net.52947: Flags [P.], seq 7708972:7709208, ack 4645, win 2017, options [nop,nop,TS val 3359277603 ecr 484756825], length 236
22:44:22.299578 IP 165.22.226.250.ssh > 66-11-178-156.cpe.distributel.net.52947: Flags [P.], seq 7709208:7709444, ack 4645, win 2017, options [nop,nop,TS val 3359277603 ecr 484756825], length 236
22:44:22.299683 IP 165.22.226.250.ssh > 66-11-178-156.cpe.distributel.net.52947: Flags [P.], seq 7709444:7709680, ack 4645, win 2017, options [nop,nop,TS val 3359277603 ecr 484756825], length 236
22:44:22.299770 IP 165.22.226.250.ssh > 66-11-178-156.cpe.distributel.net.52947: Flags [P.], seq 7709680:7709916, ack 4645, win 2017, options [nop,nop,TS val 3359277603 ecr 484756825], length 236
22:44:22.299862 IP 165.22.226.250.ssh > 66-11-178-156.cpe.distributel.net.52947: Flags [P.], seq 7709916:7710152, ack 4645, win 2017, options [nop,nop,TS val 3359277603 ecr 484756825], length 236
22:44:22.299938 IP 165.22.226.250.ssh > 66-11-178-156.cpe.distributel.net.52947: Flags [P.], seq 7710152:7710388, ack 4645, win 2017, options [nop,nop,TS val 3359277603 ecr 484756825], length 236
22:44:22.300034 IP 165.22.226.250.ssh > 66-11-178-156.cpe.distributel.net.52947: Flags [P.], seq 7710388:7710624, ack 4645, win 2017, options [nop,nop,TS val 3359277603 ecr 484756825], length 236
22:44:22.300133 IP 165.22.226.250.ssh > 66-11-178-156.cpe.distributel.net.52947: Flags [P.], seq 7710624:7710860, ack 4645, win 2017, options [nop,nop,TS val 3359277603 ecr 484756825], length 236
22:44:22.300226 IP 165.22.226.250.ssh > 66-11-178-156.cpe.distributel.net.52947: Flags [P.], seq 7710860:7711096, ack 4645, win 2017, options [nop,nop,TS val 3359277603 ecr 484756825], length 236
22:44:22.300288 IP 165.22.226.250.ssh > 66-11-178-156.cpe.distributel.net.52947: Flags [P.], seq 7711096:7711332, ack 4645, win 2017, options [nop,nop,TS val 3359277603 ecr 484756825], length 236
22:44:22.300363 IP 165.22.226.250.ssh > 66-11-178-156.cpe.distributel.net.52947: Flags [P.], seq 7711332:7711568, ack 4645, win 2017, options [nop,nop,TS val 3359277603 ecr 484756825], length 236
22:44:22.300456 IP 165.22.226.250.ssh > 66-11-178-156.cpe.distributel.net.52947: Flags [P.], seq 7711568:7711804, ack 4645, win 2017, options [nop,nop,TS val 3359277604 ecr 484756825], length 236
22:44:22.300533 IP 165.22.226.250.ssh > 66-11-178-156.cpe.distributel.net.52947: Flags [P.], seq 7711804:7712040, ack 4645, win 2017, options [nop,nop,TS val 3359277604 ecr 484756825], length 236
22:44:22.308051 IP 66-11-178-156.cpe.distributel.net.52947 > 165.22.226.250.ssh: Flags [.], ack 7658044, win 65413, options [nop,nop,TS val 484756827 ecr 3359277584], length 0
22:44:22.308128 IP 165.22.226.250.ssh > 66-11-178-156.cpe.distributel.net.52947: Flags [P.], seq 7712040:7712276, ack 4645, win 2017, options [nop,nop,TS val 3359277611 ecr 484756827], length 236
22:44:22.308325 IP 165.22.226.250.ssh > 66-11-178-156.cpe.distributel.net.52947: Flags [P.], seq 7712276:7712688, ack 4645, win 2017, options [nop,nop,TS val 3359277611 ecr 484756827], length 412
22:44:22.308401 IP 165.22.226.250.ssh > 66-11-178-156.cpe.distributel.net.52947: Flags [P.], seq 7712688:7712924, ack 4645, win 2017, options [nop,nop,TS val 3359277612 ecr 484756827], length 236
22:44:22.308483 IP 165.22.226.250.ssh > 66-11-178-156.cpe.distributel.net.52947: Flags [P.], seq 7712924:7713160, ack 4645, win 2017, options [nop,nop,TS val 3359277612 ecr 484756827], length 236
22:44:22.308570 IP 165.22.226.250.ssh > 66-11-178-156.cpe.distributel.net.52947: Flags [P.], seq 7713160:7713396, ack 4645, win 2017, options [nop,nop,TS val 3359277612 ecr 484756827], length 236
22:44:22.308646 IP 165.22.226.250.ssh > 66-11-178-156.cpe.distributel.net.52947: Flags [P.], seq 7713396:7713632, ack 4645, win 2017, options [nop,nop,TS val 3359277612 ecr 484756827], length 236
22:44:22.308715 IP 165.22.226.250.ssh > 66-11-178-156.cpe.distributel.net.52947: Flags [P.], seq 7713632:7713868, ack 4645, win 2017, options [nop,nop,TS val 3359277612 ecr 484756827], length 236
22:44:22.308777 IP 165.22.226.250.ssh > 66-11-178-156.cpe.distributel.net.52947: Flags [P.], seq 7713868:7714104, ack 4645, win 2017, options [nop,nop,TS val 3359277612 ecr 484756827], length 236
22:44:22.308865 IP 165.22.226.250.ssh > 66-11-178-156.cpe.distributel.net.52947: Flags [P.], seq 7714104:7714340, ack 4645, win 2017, options [nop,nop,TS val 3359277612 ecr 484756827], length 236
22:44:22.308967 IP 165.22.226.250.ssh > 66-11-178-156.cpe.distributel.net.52947: Flags [P.], seq 7714340:7714576, ack 4645, win 2017, options [nop,nop,TS val 3359277612 ecr 484756827], length 236
22:44:22.309036 IP 165.22.226.250.ssh > 66-11-178-156.cpe.distributel.net.52947: Flags [P.], seq 7714576:7714812, ack 4645, win 2017, options [nop,nop,TS val 3359277612 ecr 484756827], length 236
22:44:22.309113 IP 165.22.226.250.ssh > 66-11-178-156.cpe.distributel.net.52947: Flags [P.], seq 7714812:7715048, ack 4645, win 2017, options [nop,nop,TS val 3359277612 ecr 484756827], length 236
22:44:22.309186 IP 165.22.226.250.ssh > 66-11-178-156.cpe.distributel.net.52947: Flags [P.], seq 7715048:7715284, ack 4645, win 2017, options [nop,nop,TS val 3359277612 ecr 484756827], length 236
22:44:22.309253 IP 165.22.226.250.ssh > 66-11-178-156.cpe.distributel.net.52947: Flags [P.], seq 7715284:7715520, ack 4645, win 2017, options [nop,nop,TS val 3359277612 ecr 484756827], length 236
22:44:22.309321 IP 165.22.226.250.ssh > 66-11-178-156.cpe.distributel.net.52947: Flags [P.], seq 7715520:7715756, ack 4645, win 2017, options [nop,nop,TS val 3359277612 ecr 484756827], length 236
22:44:22.309412 IP 165.22.226.250.ssh > 66-11-178-156.cpe.distributel.net.52947: Flags [P.], seq 7715756:7715992, ack 4645, win 2017, options [nop,nop,TS val 3359277613 ecr 484756827], length 236
22:44:22.309506 IP 165.22.226.250.ssh > 66-11-178-156.cpe.distributel.net.52947: Flags [P.], seq 7715992:7716228, ack 4645, win 2017, options [nop,nop,TS val 3359277613 ecr 484756827], length 236
22:44:22.309628 IP 165.22.226.250.ssh > 66-11-178-156.cpe.distributel.net.52947: Flags [P.], seq 7716228:7716464, ack 4645, win 2017, options [nop,nop,TS val 3359277613 ecr 484756827], length 236
22:44:22.309723 IP 165.22.226.250.ssh > 66-11-178-156.cpe.distributel.net.52947: Flags [P.], seq 7716464:7716700, ack 4645, win 2017, options [nop,nop,TS val 3359277613 ecr 484756827], length 236
22:44:22.309784 IP 165.22.226.250.ssh > 66-11-178-156.cpe.distributel.net.52947: Flags [P.], seq 7716700:7716936, ack 4645, win 2017, options [nop,nop,TS val 3359277613 ecr 484756827], length 236
22:44:22.309850 IP 165.22.226.250.ssh > 66-11-178-156.cpe.distributel.net.52947: Flags [P.], seq 7716936:7717172, ack 4645, win 2017, options [nop,nop,TS val 3359277613 ecr 484756827], length 236
22:44:22.309906 IP 165.22.226.250.ssh > 66-11-178-156.cpe.distributel.net.52947: Flags [P.], seq 7717172:7717408, ack 4645, win 2017, options [nop,nop,TS val 3359277613 ecr 484756827], length 236
22:44:22.309963 IP 165.22.226.250.ssh > 66-11-178-156.cpe.distributel.net.52947: Flags [P.], seq 7717408:7717644, ack 4645, win 2017, options [nop,nop,TS val 3359277613 ecr 484756827], length 236
22:44:22.310020 IP 165.22.226.250.ssh > 66-11-178-156.cpe.distributel.net.52947: Flags [P.], seq 7717644:7717880, ack 4645, win 2017, options [nop,nop,TS val 3359277613 ecr 484756827], length 236
22:44:22.310089 IP 165.22.226.250.ssh > 66-11-178-156.cpe.distributel.net.52947: Flags [P.], seq 7717880:7718116, ack 4645, win 2017, options [nop,nop,TS val 3359277613 ecr 484756827], length 236
22:44:22.310169 IP 165.22.226.250.ssh > 66-11-178-156.cpe.distributel.net.52947: Flags [P.], seq 7718116:7718352, ack 4645, win 2017, options [nop,nop,TS val 3359277613 ecr 484756827], length 236
22:44:22.310243 IP 165.22.226.250.ssh > 66-11-178-156.cpe.distributel.net.52947: Flags [P.], seq 7718352:7718588, ack 4645, win 2017, options [nop,nop,TS val 3359277613 ecr 484756827], length 236
22:44:22.310301 IP 165.22.226.250.ssh > 66-11-178-156.cpe.distributel.net.52947: Flags [P.], seq 7718588:7718824, ack 4645, win 2017, options [nop,nop,TS val 3359277613 ecr 484756827], length 236
22:44:22.310368 IP 165.22.226.250.ssh > 66-11-178-156.cpe.distributel.net.52947: Flags [P.], seq 7718824:7719060, ack 4645, win 2017, options [nop,nop,TS val 3359277613 ecr 484756827], length 236
22:44:22.310429 IP 165.22.226.250.ssh > 66-11-178-156.cpe.distributel.net.52947: Flags [P.], seq 7719060:7719296, ack 4645, win 2017, options [nop,nop,TS val 3359277614 ecr 484756827], length 236
22:44:22.310511 IP 165.22.226.250.ssh > 66-11-178-156.cpe.distributel.net.52947: Flags [P.], seq 7719296:7719532, ack 4645, win 2017, options [nop,nop,TS val 3359277614 ecr 484756827], length 236
22:44:22.310602 IP 165.22.226.250.ssh > 66-11-178-156.cpe.distributel.net.52947: Flags [P.], seq 7719532:7719768, ack 4645, win 2017, options [nop,nop,TS val 3359277614 ecr 484756827], length 236
22:44:22.310694 IP 165.22.226.250.ssh > 66-11-178-156.cpe.distributel.net.52947: Flags [P.], seq 7719768:7720004, ack 4645, win 2017, options [nop,nop,TS val 3359277614 ecr 484756827], length 236
22:44:22.313266 IP 66-11-178-156.cpe.distributel.net.52947 > 165.22.226.250.ssh: Flags [P.], seq 4645:4681, ack 7672440, win 65535, options [nop,nop,TS val 484756845 ecr 3359277589], length 36
22:44:22.313355 IP 165.22.226.250.ssh > 66-11-178-156.cpe.distributel.net.52947: Flags [P.], seq 7720004:7720240, ack 4681, win 2017, options [nop,nop,TS val 3359277616 ecr 484756845], length 236