tcpdump: verbose output suppressed, use -v or -vv for full protocol decode
listening on eth0, link-type EN10MB (Ethernet), capture size 262144 bytes
22:35:34.922254 IP 165.22.226.250.ssh > 66-11-178-156.cpe.distributel.net.52947: Flags [P.], seq 415048608:415048716, ack 3772789631, win 1678, options [nop,nop,TS val 3358750225 ecr 484240203], length 108
22:35:34.922325 IP 165.22.226.250.ssh > 66-11-178-156.cpe.distributel.net.52947: Flags [P.], seq 108:144, ack 1, win 1678, options [nop,nop,TS val 3358750225 ecr 484240203], length 36
22:35:34.922376 IP 165.22.226.250.ssh > 66-11-178-156.cpe.distributel.net.52947: Flags [P.], seq 144:252, ack 1, win 1678, options [nop,nop,TS val 3358750225 ecr 484240203], length 108
22:35:34.922444 IP 165.22.226.250.ssh > 66-11-178-156.cpe.distributel.net.52947: Flags [P.], seq 252:288, ack 1, win 1678, options [nop,nop,TS val 3358750226 ecr 484240203], length 36
22:35:34.922968 IP 165.22.226.250.60792 > dns.google.domain: 7418+ PTR? 156.178.11.66.in-addr.arpa. (44)
5 packets captured
22 packets received by filter
0 packets dropped by kernel