165.22.226.250.22 > 66.11.178.156.52947: Flags [P.], seq 10253632:10253876, ack 5941, win 1972, options [nop,nop,TS val 3359211401 ecr 484692681,nop,nop,sack 1 {5977:6085}], length 244
22:43:16.097495 IP 165.22.226.250.22 > 66.11.178.156.52947: Flags [P.], seq 10253876:10254120, ack 5941, win 1972, options [nop,nop,TS val 3359211401 ecr 484692681,nop,nop,sack 1 {5977:6085}], length 244
22:43:16.097574 IP 165.22.226.250.22 > 66.11.178.156.52947: Flags [P.], seq 10254120:10254364, ack 5941, win 1972, options [nop,nop,TS val 3359211401 ecr 484692681,nop,nop,sack 1 {5977:6085}], length 244
22:43:16.097688 IP 165.22.226.250.22 > 66.11.178.156.52947: Flags [P.], seq 10254364:10254608, ack 5941, win 1972, options [nop,nop,TS val 3359211401 ecr 484692681,nop,nop,sack 1 {5977:6085}], length 244
22:43:16.097801 IP 165.22.226.250.22 > 66.11.178.156.52947: Flags [P.], seq 10254608:10254852, ack 5941, win 1972, options [nop,nop,TS val 3359211401 ecr 484692681,nop,nop,sack 1 {5977:6085}], length 244
22:43:16.097877 IP 165.22.226.250.22 > 66.11.178.156.52947: Flags [P.], seq 10254852:10255096, ack 5941, win 1972, options [nop,nop,TS val 3359211401 ecr 484692681,nop,nop,sack 1 {5977:6085}], length 244
22:43:16.097990 IP 165.22.226.250.22 > 66.11.178.156.52947: Flags [P.], seq 10255096:10255340, ack 5941, win 1972, options [nop,nop,TS val 3359211401 ecr 484692681,nop,nop,sack 1 {5977:6085}], length 244
22:43:16.098087 IP 165.22.226.250.22 > 66.11.178.156.52947: Flags [P.], seq 10255340:10255584, ack 5941, win 1972, options [nop,nop,TS val 3359211401 ecr 484692681,nop,nop,sack 1 {5977:6085}], length 244
22:43:16.098176 IP 165.22.226.250.22 > 66.11.178.156.52947: Flags [P.], seq 10255584:10255828, ack 5941, win 1972, options [nop,nop,TS val 3359211401 ecr 484692681,nop,nop,sack 1 {5977:6085}], length 244
22:43:16.098241 IP 165.22.226.250.22 > 66.11.178.156.52947: Flags [P.], seq 10255828:10256072, ack 5941, win 1972, options [nop,nop,TS val 3359211401 ecr 484692681,nop,nop,sack 1 {5977:6085}], length 244
22:43:16.098309 IP 165.22.226.250.22 > 66.11.178.156.52947: Flags [P.], seq 10256072:10256316, ack 5941, win 1972, options [nop,nop,TS val 3359211401 ecr 484692681,nop,nop,sack 1 {5977:6085}], length 244
22:43:16.098372 IP 165.22.226.250.22 > 66.11.178.156.52947: Flags [P.], seq 10256316:10256560, ack 5941, win 1972, options [nop,nop,TS val 3359211401 ecr 484692681,nop,nop,sack 1 {5977:6085}], length 244
22:43:16.098428 IP 165.22.226.250.22 > 66.11.178.156.52947: Flags [P.], seq 10256560:10256804, ack 5941, win 1972, options [nop,nop,TS val 3359211402 ecr 484692681,nop,nop,sack 1 {5977:6085}], length 244
22:43:16.098492 IP 165.22.226.250.22 > 66.11.178.156.52947: Flags [P.], seq 10256804:10257048, ack 5941, win 1972, options [nop,nop,TS val 3359211402 ecr 484692681,nop,nop,sack 1 {5977:6085}], length 244
22:43:16.098553 IP 165.22.226.250.22 > 66.11.178.156.52947: Flags [P.], seq 10257048:10257292, ack 5941, win 1972, options [nop,nop,TS val 3359211402 ecr 484692681,nop,nop,sack 1 {5977:6085}], length 244
22:43:16.098635 IP 165.22.226.250.22 > 66.11.178.156.52947: Flags [P.], seq 10257292:10257536, ack 5941, win 1972, options [nop,nop,TS val 3359211402 ecr 484692681,nop,nop,sack 1 {5977:6085}], length 244
22:43:16.098694 IP 165.22.226.250.22 > 66.11.178.156.52947: Flags [P.], seq 10257536:10257780, ack 5941, win 1972, options [nop,nop,TS val 3359211402 ecr 484692681,nop,nop,sack 1 {5977:6085}], length 244
22:43:16.098757 IP 165.22.226.250.22 > 66.11.178.156.52947: Flags [P.], seq 10257780:10258024, ack 5941, win 1972, options [nop,nop,TS val 3359211402 ecr 484692681,nop,nop,sack 1 {5977:6085}], length 244
22:43:16.098815 IP 165.22.226.250.22 > 66.11.178.156.52947: Flags [P.], seq 10258024:10258268, ack 5941, win 1972, options [nop,nop,TS val 3359211402 ecr 484692681,nop,nop,sack 1 {5977:6085}], length 244
22:43:16.124379 IP 66.11.178.156.52947 > 165.22.226.250.22: Flags [.], ack 10130200, win 65535, options [nop,nop,TS val 484692754 ecr 3359211364], length 0
22:43:16.128474 IP 66.11.178.156.52947 > 165.22.226.250.22: Flags [P.], seq 6085:6121, ack 10130200, win 65535, options [nop,nop,TS val 484692755 ecr 3359211364], length 36
22:43:16.128542 IP 165.22.226.250.22 > 66.11.178.156.52947: Flags [.], ack 5941, win 1972, options [nop,nop,TS val 3359211432 ecr 484692681,nop,nop,sack 1 {5977:6121}], length 0
22:43:16.128563 IP 66.11.178.156.52947 > 165.22.226.250.22: Flags [P.], seq 6121:6157, ack 10130200, win 65535, options [nop,nop,TS val 484692762 ecr 3359211364], length 36
22:43:16.129603 IP 165.22.226.250.22 > 66.11.178.156.52947: Flags [.], ack 5941, win 1972, options [nop,nop,TS val 3359211432 ecr 484692681,nop,nop,sack 1 {5977:6157}], length 0
22:43:16.155870 IP 66.11.178.156.52947 > 165.22.226.250.22: Flags [.], ack 10141820, win 65353, options [nop,nop,TS val 484692814 ecr 3359211367], length 0
22:43:16.155983 IP 165.22.226.250.22 > 66.11.178.156.52947: Flags [P.], seq 10258268:10259492, ack 5941, win 1972, options [nop,nop,TS val 3359211459 ecr 484692681,nop,nop,sack 1 {5977:6157}], length 1224
22:43:16.156258 IP 165.22.226.250.22 > 66.11.178.156.52947: Flags [P.], seq 10259492:10259896, ack 5941, win 1972, options [nop,nop,TS val 3359211459 ecr 484692681,nop,nop,sack 1 {5977:6157}], length 404
22:43:16.156374 IP 165.22.226.250.22 > 66.11.178.156.52947: Flags [P.], seq 10259896:10260140, ack 5941, win 1972, options [nop,nop,TS val 3359211459 ecr 484692681,nop,nop,sack 1 {5977:6157}], length 244
22:43:16.156477 IP 165.22.226.250.22 > 66.11.178.156.52947: Flags [P.], seq 10260140:10260384, ack 5941, win 1972, options [nop,nop,TS val 3359211460 ecr 484692681,nop,nop,sack 1 {5977:6157}], length 244
22:43:16.156582 IP 165.22.226.250.22 > 66.11.178.156.52947: Flags [P.], seq 10260384:10260628, ack 5941, win 1972, options [nop,nop,TS val 3359211460 ecr 484692681,nop,nop,sack 1 {5977:6157}], length 244
22:43:16.156688 IP 165.22.226.250.22 > 66.11.178.156.52947: Flags [P.], seq 10260628:10260872, ack 5941, win 1972, options [nop,nop,TS val 3359211460 ecr 484692681,nop,nop,sack 1 {5977:6157}], length 244
22:43:16.156791 IP 165.22.226.250.22 > 66.11.178.156.52947: Flags [P.], seq 10260872:10261116, ack 5941, win 1972, options [nop,nop,TS val 3359211460 ecr 484692681,nop,nop,sack 1 {5977:6157}], length 244
22:43:16.156835 IP 66.11.178.156.52947 > 165.22.226.250.22: Flags [.], ack 10150848, win 65535, options [nop,nop,TS val 484692817 ecr 3359211367], length 0
22:43:16.156982 IP 165.22.226.250.22 > 66.11.178.156.52947: Flags [P.], seq 10261116:10261512, ack 5941, win 1972, options [nop,nop,TS val 3359211460 ecr 484692681,nop,nop,sack 1 {5977:6157}], length 396
22:43:16.157084 IP 165.22.226.250.22 > 66.11.178.156.52947: Flags [P.], seq 10261512:10261756, ack 5941, win 1972, options [nop,nop,TS val 3359211460 ecr 484692681,nop,nop,sack 1 {5977:6157}], length 244
22:43:16.157183 IP 165.22.226.250.22 > 66.11.178.156.52947: Flags [P.], seq 10261756:10262000, ack 5941, win 1972, options [nop,nop,TS val 3359211460 ecr 484692681,nop,nop,sack 1 {5977:6157}], length 244
22:43:16.157279 IP 165.22.226.250.22 > 66.11.178.156.52947: Flags [P.], seq 10262000:10262244, ack 5941, win 1972, options [nop,nop,TS val 3359211460 ecr 484692681,nop,nop,sack 1 {5977:6157}], length 244
22:43:16.157431 IP 165.22.226.250.22 > 66.11.178.156.52947: Flags [P.], seq 10262244:10262488, ack 5941, win 1972, options [nop,nop,TS val 3359211461 ecr 484692681,nop,nop,sack 1 {5977:6157}], length 244
22:43:16.157538 IP 165.22.226.250.22 > 66.11.178.156.52947: Flags [P.], seq 10262488:10262732, ack 5941, win 1972, options [nop,nop,TS val 3359211461 ecr 484692681,nop,nop,sack 1 {5977:6157}], length 244
22:43:16.157639 IP 165.22.226.250.22 > 66.11.178.156.52947: Flags [P.], seq 10262732:10262976, ack 5941, win 1972, options [nop,nop,TS val 3359211461 ecr 484692681,nop,nop,sack 1 {5977:6157}], length 244
22:43:16.157733 IP 165.22.226.250.22 > 66.11.178.156.52947: Flags [P.], seq 10262976:10263220, ack 5941, win 1972, options [nop,nop,TS val 3359211461 ecr 484692681,nop,nop,sack 1 {5977:6157}], length 244
22:43:16.157819 IP 165.22.226.250.22 > 66.11.178.156.52947: Flags [P.], seq 10263220:10263464, ack 5941, win 1972, options [nop,nop,TS val 3359211461 ecr 484692681,nop,nop,sack 1 {5977:6157}], length 244
22:43:16.157909 IP 165.22.226.250.22 > 66.11.178.156.52947: Flags [P.], seq 10263464:10263708, ack 5941, win 1972, options [nop,nop,TS val 3359211461 ecr 484692681,nop,nop,sack 1 {5977:6157}], length 244
22:43:16.157993 IP 165.22.226.250.22 > 66.11.178.156.52947: Flags [P.], seq 10263708:10263952, ack 5941, win 1972, options [nop,nop,TS val 3359211461 ecr 484692681,nop,nop,sack 1 {5977:6157}], length 244
22:43:16.158081 IP 165.22.226.250.22 > 66.11.178.156.52947: Flags [P.], seq 10263952:10264196, ack 5941, win 1972, options [nop,nop,TS val 3359211461 ecr 484692681,nop,nop,sack 1 {5977:6157}], length 244
22:43:16.158171 IP 165.22.226.250.22 > 66.11.178.156.52947: Flags [P.], seq 10264196:10264440, ack 5941, win 1972, options [nop,nop,TS val 3359211461 ecr 484692681,nop,nop,sack 1 {5977:6157}], length 244
22:43:16.158308 IP 165.22.226.250.22 > 66.11.178.156.52947: Flags [P.], seq 10264440:10264684, ack 5941, win 1972, options [nop,nop,TS val 3359211461 ecr 484692681,nop,nop,sack 1 {5977:6157}], length 244
22:43:16.158420 IP 165.22.226.250.22 > 66.11.178.156.52947: Flags [P.], seq 10264684:10264928, ack 5941, win 1972, options [nop,nop,TS val 3359211462 ecr 484692681,nop,nop,sack 1 {5977:6157}], length 244
22:43:16.158516 IP 165.22.226.250.22 > 66.11.178.156.52947: Flags [P.], seq 10264928:10265172, ack 5941, win 1972, options [nop,nop,TS val 3359211462 ecr 484692681,nop,nop,sack 1 {5977:6157}], length 244
22:43:16.158606 IP 165.22.226.250.22 > 66.11.178.156.52947: Flags [P.], seq 10265172:10265416, ack 5941, win 1972, options [nop,nop,TS val 3359211462 ecr 484692681,nop,nop,sack 1 {5977:6157}], length 244
22:43:16.158700 IP 165.22.226.250.22 > 66.11.178.156.52947: Flags [P.], seq 10265416:10265660, ack 5941, win 1972, options [nop,nop,TS val 3359211462 ecr 484692681,nop,nop,sack 1 {5977:6157}], length 244
22:43:16.158791 IP 165.22.226.250.22 > 66.11.178.156.52947: Flags [P.], seq 10265660:10265904, ack 5941, win 1972, options [nop,nop,TS val 3359211462 ecr 484692681,nop,nop,sack 1 {5977:6157}], length 244
22:43:16.158900 IP 165.22.226.250.22 > 66.11.178.156.52947: Flags [P.], seq 10265904:10266148, ack 5941, win 1972, options [nop,nop,TS val 3359211462 ecr 484692681,nop,nop,sack 1 {5977:6157}], length 244
22:43:16.158994 IP 165.22.226.250.22 > 66.11.178.156.52947: Flags [P.], seq 10266148:10266392, ack 5941, win 1972, options [nop,nop,TS val 3359211462 ecr 484692681,nop,nop,sack 1 {5977:6157}], length 244
22:43:16.159096 IP 165.22.226.250.22 > 66.11.178.156.52947: Flags [P.], seq 10266392:10266636, ack 5941, win 1972, options [nop,nop,TS val 3359211462 ecr 484692681,nop,nop,sack 1 {5977:6157}], length 244
22:43:16.159187 IP 165.22.226.250.22 > 66.11.178.156.52947: Flags [P.], seq 10266636:10266880, ack 5941, win 1972, options [nop,nop,TS val 3359211462 ecr 484692681,nop,nop,sack 1 {5977:6157}], length 244
22:43:16.159283 IP 165.22.226.250.22 > 66.11.178.156.52947: Flags [P.], seq 10266880:10267124, ack 5941, win 1972, options [nop,nop,TS val 3359211462 ecr 484692681,nop,nop,sack 1 {5977:6157}], length 244
22:43:16.159373 IP 165.22.226.250.22 > 66.11.178.156.52947: Flags [P.], seq 10267124:10267368, ack 5941, win 1972, options [nop,nop,TS val 3359211462 ecr 484692681,nop,nop,sack 1 {5977:6157}], length 244
22:43:16.159475 IP 165.22.226.250.22 > 66.11.178.156.52947: Flags [P.], seq 10267368:10267612, ack 5941, win 1972, options [nop,nop,TS val 3359211463 ecr 484692681,nop,nop,sack 1 {5977:6157}], length 244
22:43:16.159568 IP 165.22.226.250.22 > 66.11.178.156.52947: Flags [P.], seq 10267612:10267856, ack 5941, win 1972, options [nop,nop,TS val 3359211463 ecr 484692681,nop,nop,sack 1 {5977:6157}], length 244
22:43:16.159661 IP 165.22.226.250.22 > 66.11.178.156.52947: Flags [P.], seq 10267856:10268100, ack 5941, win 1972, options [nop,nop,TS val 3359211463 ecr 484692681,nop,nop,sack 1 {5977:6157}], length 244
22:43:16.159763 IP 165.22.226.250.22 > 66.11.178.156.52947: Flags [P.], seq 10268100:10268344, ack 5941, win 1972, options [nop,nop,TS val 3359211463 ecr 484692681,nop,nop,sack 1 {5977:6157}], length 244
22:43:16.159865 IP 165.22.226.250.22 > 66.11.178.156.52947: Flags [P.], seq 10268344:10268588, ack 5941, win 1972, options [nop,nop,TS val 3359211463 ecr 484692681,nop,nop,sack 1 {5977:6157}], length 244
22:43:16.159953 IP 165.22.226.250.22 > 66.11.178.156.52947: Flags [P.], seq 10268588:10268832, ack 5941, win 1972, options [nop,nop,TS val 3359211463 ecr 484692681,nop,nop,sack 1 {5977:6157}], length 244
22:43:16.160042 IP 165.22.226.250.22 > 66.11.178.156.52947: Flags [P.], seq 10268832:10269076, ack 5941, win 1972, options [nop,nop,TS val 3359211463 ecr 484692681,nop,nop,sack 1 {5977:6157}], length 244
22:43:16.160139 IP 165.22.226.250.22 > 66.11.178.156.52947: Flags [P.], seq 10269076:10269320, ack 5941, win 1972, options [nop,nop,TS val 3359211463 ecr 484692681,nop,nop,sack 1 {5977:6157}], length 244
22:43:16.160228 IP 165.22.226.250.22 > 66.11.178.156.52947: Flags [P.], seq 10269320:10269564, ack 5941, win 1972, options [nop,nop,TS val 3359211463 ecr 484692681,nop,nop,sack 1 {5977:6157}], length 244
22:43:16.160333 IP 165.22.226.250.22 > 66.11.178.156.52947: Flags [P.], seq 10269564:10269808, ack 5941, win 1972, options [nop,nop,TS val 3359211463 ecr 484692681,nop,nop,sack 1 {5977:6157}], length 244
22:43:16.160441 IP 165.22.226.250.22 > 66.11.178.156.52947: Flags [P.], seq 10269808:10270052, ack 5941, win 1972, options [nop,nop,TS val 3359211464 ecr 484692681,nop,nop,sack 1 {5977:6157}], length 244
22:43:16.160546 IP 165.22.226.250.22 > 66.11.178.156.52947: Flags [P.], seq 10270052:10270296, ack 5941, win 1972, options [nop,nop,TS val 3359211464 ecr 484692681,nop,nop,sack 1 {5977:6157}], length 244
22:43:16.160645 IP 165.22.226.250.22 > 66.11.178.156.52947: Flags [P.], seq 10270296:10270540, ack 5941, win 1972, options [nop,nop,TS val 3359211464 ecr 484692681,nop,nop,sack 1 {5977:6157}], length 244
22:43:16.160740 IP 165.22.226.250.22 > 66.11.178.156.52947: Flags [P.], seq 10270540:10270784, ack 5941, win 1972, options [nop,nop,TS val 3359211464 ecr 484692681,nop,nop,sack 1 {5977:6157}], length 244
22:43:16.160854 IP 165.22.226.250.22 > 66.11.178.156.52947: Flags [P.], seq 10270784:10271028, ack 5941, win 1972, options [nop,nop,TS val 3359211464 ecr 484692681,nop,nop,sack 1 {5977:6157}], length 244
22:43:16.160953 IP 165.22.226.250.22 > 66.11.178.156.52947: Flags [P.], seq 10271028:10271272, ack 5941, win 1972, options [nop,nop,TS val 3359211464 ecr 484692681,nop,nop,sack 1 {5977:6157}], length 244
22:43:16.161053 IP 165.22.226.250.22 > 66.11.178.156.52947: Flags [P.], seq 10271272:10271516, ack 5941, win 1972, options [nop,nop,TS val 3359211464 ecr 484692681,nop,nop,sack 1 {5977:6157}], length 244
22:43:16.161153 IP 165.22.226.250.22 > 66.11.178.156.52947: Flags [P.], seq 10271516:10271760, ack 5941, win 1972, options [nop,nop,TS val 3359211464 ecr 484692681,nop,nop,sack 1 {5977:6157}], length 244
22:43:16.161241 IP 165.22.226.250.22 > 66.11.178.156.52947: Flags [P.], seq 10271760:10272004, ack 5941, win 1972, options [nop,nop,TS val 3359211464 ecr 484692681,nop,nop,sack 1 {5977:6157}], length 244
22:43:16.161340 IP 165.22.226.250.22 > 66.11.178.156.52947: Flags [P.], seq 10272004:10272248, ack 5941, win 1972, options [nop,nop,TS val 3359211464 ecr 484692681,nop,nop,sack 1 {5977:6157}], length 244
22:43:16.161450 IP 165.22.226.250.22 > 66.11.178.156.52947: Flags [P.], seq 10272248:10272492, ack 5941, win 1972, options [nop,nop,TS val 3359211465 ecr 484692681,nop,nop,sack 1 {5977:6157}], length 244
22:43:16.161550 IP 165.22.226.250.22 > 66.11.178.156.52947: Flags [P.], seq 10272492:10272736, ack 5941, win 1972, options [nop,nop,TS val 3359211465 ecr 484692681,nop,nop,sack 1 {5977:6157}], length 244
22:43:16.161648 IP 165.22.226.250.22 > 66.11.178.156.52947: Flags [P.], seq 10272736:10272980, ack 5941, win 1972, options [nop,nop,TS val 3359211465 ecr 484692681,nop,nop,sack 1 {5977:6157}], length 244
22:43:16.161734 IP 165.22.226.250.22 > 66.11.178.156.52947: Flags [P.], seq 10272980:10273224, ack 5941, win 1972, options [nop,nop,TS val 3359211465 ecr 484692681,nop,nop,sack 1 {5977:6157}], length 244
22:43:16.161817 IP 165.22.226.250.22 > 66.11.178.156.52947: Flags [P.], seq 10273224:10273468, ack 5941, win 1972, options [nop,nop,TS val 3359211465 ecr 484692681,nop,nop,sack 1 {5977:6157}], length 244
22:43:16.161912 IP 165.22.226.250.22 > 66.11.178.156.52947: Flags [P.], seq 10273468:10273712, ack 5941, win 1972, options [nop,nop,TS val 3359211465 ecr 484692681,nop,nop,sack 1 {5977:6157}], length 244
22:43:16.162004 IP 165.22.226.250.22 > 66.11.178.156.52947: Flags [P.], seq 10273712:10273956, ack 5941, win 1972, options [nop,nop,TS val 3359211465 ecr 484692681,nop,nop,sack 1 {5977:6157}], length 244
22:43:16.162094 IP 165.22.226.250.22 > 66.11.178.156.52947: Flags [P.], seq 10273956:10274200, ack 5941, win 1972, options [nop,nop,TS val 3359211465 ecr 484692681,nop,nop,sack 1 {5977:6157}], length 244
22:43:16.162189 IP 165.22.226.250.22 > 66.11.178.156.52947: Flags [P.], seq 10274200:10274444, ack 5941, win 1972, options [nop,nop,TS val 3359211465 ecr 484692681,nop,nop,sack 1 {5977:6157}], length 244
22:43:16.162281 IP 165.22.226.250.22 > 66.11.178.156.52947: Flags [P.], seq 10274444:10274688, ack 5941, win 1972, options [nop,nop,TS val 3359211465 ecr 484692681,nop,nop,sack 1 {5977:6157}], length 244
22:43:16.162376 IP 165.22.226.250.22 > 66.11.178.156.52947: Flags [P.], seq 10274688:10274932, ack 5941, win 1972, options [nop,nop,TS val 3359211465 ecr 484692681,nop,nop,sack 1 {5977:6157}], length 244
22:43:16.162513 IP 165.22.226.250.22 > 66.11.178.156.52947: Flags [P.], seq 10274932:10275176, ack 5941, win 1972, options [nop,nop,TS val 3359211466 ecr 484692681,nop,nop,sack 1 {5977:6157}], length 244
22:43:16.162618 IP 165.22.226.250.22 > 66.11.178.156.52947: Flags [P.], seq 10275176:10275420, ack 5941, win 1972, options [nop,nop,TS val 3359211466 ecr 484692681,nop,nop,sack 1 {5977:6157}], length 244
22:43:16.162714 IP 165.22.226.250.22 > 66.11.178.156.52947: Flags [P.], seq 10275420:10275664, ack 5941, win 1972, options [nop,nop,TS val 3359211466 ecr 484692681,nop,nop,sack 1 {5977:6157}], length 244
22:43:16.162798 IP 165.22.226.250.22 > 66.11.178.156.52947: Flags [P.], seq 10275664:10275908, ack 5941, win 1972, options [nop,nop,TS val 3359211466 ecr 484692681,nop,nop,sack 1 {5977:6157}], length 244
22:43:16.162893 IP 165.22.226.250.22 > 66.11.178.156.52947: Flags [P.], seq 10275908:10276152, ack 5941, win 1972, options [nop,nop,TS val 3359211466 ecr 484692681,nop,nop,sack 1 {5977:6157}], length 244
22:43:16.162998 IP 165.22.226.250.22 > 66.11.178.156.52947: Flags [P.], seq 10276152:10276396, ack 5941, win 1972, options [nop,nop,TS val 3359211466 ecr 484692681,nop,nop,sack 1 {5977:6157}], length 244
22:43:16.163097 IP 165.22.226.250.22 > 66.11.178.156.52947: Flags [P.], seq 10276396:10276640, ack 5941, win 1972, options [nop,nop,TS val 3359211466 ecr 484692681,nop,nop,sack 1 {5977:6157}], length 244
22:43:16.163198 IP 165.22.226.250.22 > 66.11.178.156.52947: Flags [P.], seq 10276640:10276884, ack 5941, win 1972, options [nop,nop,TS val 3359211466 ecr 484692681,nop,nop,sack 1 {5977:6157}], length 244
22:43:16.163285 IP 165.22.226.250.22 > 66.11.178.156.52947: Flags [P.], seq 10276884:10277128, ack 5941, win 1972, options [nop,nop,TS val 3359211466 ecr 484692681,nop,nop,sack 1 {5977:6157}], length 244
22:43:16.163376 IP 165.22.226.250.22 > 66.11.178.156.52947: Flags [P.], seq 10277128:10277372, ack 5941, win 1972, options [nop,nop,TS val 3359211466 ecr 484692681,nop,nop,sack 1 {5977:6157}], length 244
22:43:16.163489 IP 165.22.226.250.22 > 66.11.178.156.52947: Flags [P.], seq 10277372:10277616, ack 5941, win 1972, options [nop,nop,TS val 3359211467 ecr 484692681,nop,nop,sack 1 {5977:6157}], length 244
22:43:16.163588 IP 165.22.226.250.22 > 66.11.178.156.52947: Flags [P.], seq 10277616:10277860, ack 5941, win 1972, options [nop,nop,TS val 3359211467 ecr 484692681,nop,nop,sack 1 {5977:6157}], length 244
22:43:16.163679 IP 165.22.226.250.22 > 66.11.178.156.52947: Flags [P.], seq 10277860:10278104, ack 5941, win 1972, options [nop,nop,TS val 3359211467 ecr 484692681,nop,nop,sack 1 {5977:6157}], length 244
22:43:16.163777 IP 165.22.226.250.22 > 66.11.178.156.52947: Flags [P.], seq 10278104:10278348, ack 5941, win 1972, options [nop,nop,TS val 3359211467 ecr 484692681,nop,nop,sack 1 {5977:6157}], length 244
22:43:16.163867 IP 165.22.226.250.22 > 66.11.178.156.52947: Flags [P.], seq 10278348:10278592, ack 5941, win 1972, options [nop,nop,TS val 3359211467 ecr 484692681,nop,nop,sack 1 {5977:6157}], length 244
22:43:16.163954 IP 165.22.226.250.22 > 66.11.178.156.52947: Flags [P.], seq 10278592:10278836, ack 5941, win 1972, options [nop,nop,TS val 3359211467 ecr 484692681,nop,nop,sack 1 {5977:6157}], length 244
22:43:16.164038 IP 165.22.226.250.22 > 66.11.178.156.52947: Flags [P.], seq 10278836:10279080, ack 5941, win 1972, options [nop,nop,TS val 3359211467 ecr 484692681,nop,nop,sack 1 {5977:6157}], length 244
22:43:16.164121 IP 165.22.226.250.22 > 66.11.178.156.52947: Flags [P.], seq 10279080:10279324, ack 5941, win 1972, options [nop,nop,TS val 3359211467 ecr 484692681,nop,nop,sack 1 {5977:6157}], length 244
22:43:16.164214 IP 165.22.226.250.22 > 66.11.178.156.52947: Flags [P.], seq 10279324:10279568, ack 5941, win 1972, options [nop,nop,TS val 3359211467 ecr 484692681,nop,nop,sack 1 {5977:6157}], length 244
22:43:16.164324 IP 165.22.226.250.22 > 66.11.178.156.52947: Flags [P.], seq 10279568:10279812, ack 5941, win 1972, options [nop,nop,TS val 3359211467 ecr 484692681,nop,nop,sack 1 {5977:6157}], length 244
22:43:16.164418 IP 165.22.226.250.22 > 66.11.178.156.52947: Flags [P.], seq 10279812:10280056, ack 5941, win 1972, options [nop,nop,TS val 3359211468 ecr 484692681,nop,nop,sack 1 {5977:6157}], length 244
22:43:16.164505 IP 165.22.226.250.22 > 66.11.178.156.52947: Flags [P.], seq 10280056:10280300, ack 5941, win 1972, options [nop,nop,TS val 3359211468 ecr 484692681,nop,nop,sack 1 {5977:6157}], length 244
22:43:16.168000 IP 66.11.178.156.52947 > 165.22.226.250.22: Flags [.], ack 10164908, win 65401, options [nop,nop,TS val 484692838 ecr 3359211374], length 0
22:43:16.168093 IP 165.22.226.250.22 > 66.11.178.156.52947: Flags [P.], seq 10280300:10280544, ack 5941, win 1972, options [nop,nop,TS val 3359211471 ecr 484692681,nop,nop,sack 1 {5977:6157}], length 244
22:43:16.168307 IP 165.22.226.250.22 > 66.11.178.156.52947: Flags [P.], seq 10280544:10280940, ack 5941, win 1972, options [nop,nop,TS val 3359211471 ecr 484692681,nop,nop,sack 1 {5977:6157}], length 396
22:43:16.168429 IP 165.22.226.250.22 > 66.11.178.156.52947: Flags [P.], seq 10280940:10281184, ack 5941, win 1972, options [nop,nop,TS val 3359211472 ecr 484692681,nop,nop,sack 1 {5977:6157}], length 244
22:43:16.168542 IP 165.22.226.250.22 > 66.11.178.156.52947: Flags [P.], seq 10281184:10281428, ack 5941, win 1972, options [nop,nop,TS val 3359211472 ecr 484692681,nop,nop,sack 1 {5977:6157}], length 244
22:43:16.168659 IP 165.22.226.250.22 > 66.11.178.156.52947: Flags [P.], seq 10281428:10281672, ack 5941, win 1972, options [nop,nop,TS val 3359211472 ecr 484692681,nop,nop,sack 1 {5977:6157}], length 244
22:43:16.168758 IP 165.22.226.250.22 > 66.11.178.156.52947: Flags [P.], seq 10281672:10281916, ack 5941, win 1972, options [nop,nop,TS val 3359211472 ecr 484692681,nop,nop,sack 1 {5977:6157}], length 244
22:43:16.168872 IP 165.22.226.250.22 > 66.11.178.156.52947: Flags [P.], seq 10281916:10282160, ack 5941, win 1972, options [nop,nop,TS val 3359211472 ecr 484692681,nop,nop,sack 1 {5977:6157}], length 244
22:43:16.168966 IP 165.22.226.250.22 > 66.11.178.156.52947: Flags [P.], seq 10282160:10282404, ack 5941, win 1972, options [nop,nop,TS val 3359211472 ecr 484692681,nop,nop,sack 1 {5977:6157}], length 244
22:43:16.169060 IP 165.22.226.250.22 > 66.11.178.156.52947: Flags [P.], seq 10282404:10282648, ack 5941, win 1972, options [nop,nop,TS val 3359211472 ecr 484692681,nop,nop,sack 1 {5977:6157}], length 244
22:43:16.169176 IP 165.22.226.250.22 > 66.11.178.156.52947: Flags [P.], seq 10282648:10282892, ack 5941, win 1972, options [nop,nop,TS val 3359211472 ecr 484692681,nop,nop,sack 1 {5977:6157}], length 244
22:43:16.169276 IP 165.22.226.250.22 > 66.11.178.156.52947: Flags [P.], seq 10282892:10283136, ack 5941, win 1972, options [nop,nop,TS val 3359211472 ecr 484692681,nop,nop,sack 1 {5977:6157}], length 244
22:43:16.169373 IP 165.22.226.250.22 > 66.11.178.156.52947: Flags [P.], seq 10283136:10283380, ack 5941, win 1972, options [nop,nop,TS val 3359211472 ecr 484692681,nop,nop,sack 1 {5977:6157}], length 244
22:43:16.169503 IP 165.22.226.250.22 > 66.11.178.156.52947: Flags [P.], seq 10283380:10283624, ack 5941, win 1972, options [nop,nop,TS val 3359211473 ecr 484692681,nop,nop,sack 1 {5977:6157}], length 244
22:43:16.169596 IP 165.22.226.250.22 > 66.11.178.156.52947: Flags [P.], seq 10283624:10283868, ack 5941, win 1972, options [nop,nop,TS val 3359211473 ecr 484692681,nop,nop,sack 1 {5977:6157}], length 244
22:43:16.169692 IP 165.22.226.250.22 > 66.11.178.156.52947: Flags [P.], seq 10283868:10284112, ack 5941, win 1972, options [nop,nop,TS val 3359211473 ecr 484692681,nop,nop,sack 1 {5977:6157}], length 244
22:43:16.169788 IP 165.22.226.250.22 > 66.11.178.156.52947: Flags [P.], seq 10284112:10284356, ack 5941, win 1972, options [nop,nop,TS val 3359211473 ecr 484692681,nop,nop,sack 1 {5977:6157}], length 244
22:43:16.169879 IP 165.22.226.250.22 > 66.11.178.156.52947: Flags [P.], seq 10284356:10284600, ack 5941, win 1972, options [nop,nop,TS val 3359211473 ecr 484692681,nop,nop,sack 1 {5977:6157}], length 244
22:43:16.169973 IP 165.22.226.250.22 > 66.11.178.156.52947: Flags [P.], seq 10284600:10284844, ack 5941, win 1972, options [nop,nop,TS val 3359211473 ecr 484692681,nop,nop,sack 1 {5977:6157}], length 244
22:43:16.170070 IP 165.22.226.250.22 > 66.11.178.156.52947: Flags [P.], seq 10284844:10285088, ack 5941, win 1972, options [nop,nop,TS val 3359211473 ecr 484692681,nop,nop,sack 1 {5977:6157}], length 244
22:43:16.170173 IP 165.22.226.250.22 > 66.11.178.156.52947: Flags [P.], seq 10285088:10285332, ack 5941, win 1972, options [nop,nop,TS val 3359211473 ecr 484692681,nop,nop,sack 1 {5977:6157}], length 244
22:43:16.170258 IP 165.22.226.250.22 > 66.11.178.156.52947: Flags [P.], seq 10285332:10285576, ack 5941, win 1972, options [nop,nop,TS val 3359211473 ecr 484692681,nop,nop,sack 1 {5977:6157}], length 244
22:43:16.170345 IP 165.22.226.250.22 > 66.11.178.156.52947: Flags [P.], seq 10285576:10285820, ack 5941, win 1972, options [nop,nop,TS val 3359211473 ecr 484692681,nop,nop,sack 1 {5977:6157}], length 244
22:43:16.170429 IP 165.22.226.250.22 > 66.11.178.156.52947: Flags [P.], seq 10285820:10286064, ack 5941, win 1972, options [nop,nop,TS val 3359211474 ecr 484692681,nop,nop,sack 1 {5977:6157}], length 244
22:43:16.170515 IP 165.22.226.250.22 > 66.11.178.156.52947: Flags [P.], seq 10286064:10286308, ack 5941, win 1972, options [nop,nop,TS val 3359211474 ecr 484692681,nop,nop,sack 1 {5977:6157}], length 244
22:43:16.170616 IP 165.22.226.250.22 > 66.11.178.156.52947: Flags [P.], seq 10286308:10286552, ack 5941, win 1972, options [nop,nop,TS val 3359211474 ecr 484692681,nop,nop,sack 1 {5977:6157}], length 244
22:43:16.170702 IP 165.22.226.250.22 > 66.11.178.156.52947: Flags [P.], seq 10286552:10286796, ack 5941, win 1972, options [nop,nop,TS val 3359211474 ecr 484692681,nop,nop,sack 1 {5977:6157}], length 244
22:43:16.170786 IP 165.22.226.250.22 > 66.11.178.156.52947: Flags [P.], seq 10286796:10287040, ack 5941, win 1972, options [nop,nop,TS val 3359211474 ecr 484692681,nop,nop,sack 1 {5977:6157}], length 244
22:43:16.170870 IP 165.22.226.250.22 > 66.11.178.156.52947: Flags [P.], seq 10287040:10287284, ack 5941, win 1972, options [nop,nop,TS val 3359211474 ecr 484692681,nop,nop,sack 1 {5977:6157}], length 244
22:43:16.170959 IP 165.22.226.250.22 > 66.11.178.156.52947: Flags [P.], seq 10287284:10287528, ack 5941, win 1972, options [nop,nop,TS val 3359211474 ecr 484692681,nop,nop,sack 1 {5977:6157}], length 244
22:43:16.171049 IP 165.22.226.250.22 > 66.11.178.156.52947: Flags [P.], seq 10287528:10287772, ack 5941, win 1972, options [nop,nop,TS val 3359211474 ecr 484692681,nop,nop,sack 1 {5977:6157}], length 244
22:43:16.171147 IP 165.22.226.250.22 > 66.11.178.156.52947: Flags [P.], seq 10287772:10288016, ack 5941, win 1972, options [nop,nop,TS val 3359211474 ecr 484692681,nop,nop,sack 1 {5977:6157}], length 244
22:43:16.171238 IP 165.22.226.250.22 > 66.11.178.156.52947: Flags [P.], seq 10288016:10288260, ack 5941, win 1972, options [nop,nop,TS val 3359211474 ecr 484692681,nop,nop,sack 1 {5977:6157}], length 244
22:43:16.171337 IP 165.22.226.250.22 > 66.11.178.156.52947: Flags [P.], seq 10288260:10288504, ack 5941, win 1972, options [nop,nop,TS val 3359211474 ecr 484692681,nop,nop,sack 1 {5977:6157}], length 244
22:43:16.171425 IP 165.22.226.250.22 > 66.11.178.156.52947: Flags [P.], seq 10288504:10288748, ack 5941, win 1972, options [nop,nop,TS val 3359211475 ecr 484692681,nop,nop,sack 1 {5977:6157}], length 244
22:43:16.171520 IP 165.22.226.250.22 > 66.11.178.156.52947: Flags [P.], seq 10288748:10288992, ack 5941, win 1972, options [nop,nop,TS val 3359211475 ecr 484692681,nop,nop,sack 1 {5977:6157}], length 244
22:43:16.171614 IP 165.22.226.250.22 > 66.11.178.156.52947: Flags [P.], seq 10288992:10289236, ack 5941, win 1972, options [nop,nop,TS val 3359211475 ecr 484692681,nop,nop,sack 1 {5977:6157}], length 244
22:43:16.171708 IP 165.22.226.250.22 > 66.11.178.156.52947: Flags [P.], seq 10289236:10289480, ack 5941, win 1972, options [nop,nop,TS val 3359211475 ecr 484692681,nop,nop,sack 1 {5977:6157}], length 244
22:43:16.171812 IP 165.22.226.250.22 > 66.11.178.156.52947: Flags [P.], seq 10289480:10289724, ack 5941, win 1972, options [nop,nop,TS val 3359211475 ecr 484692681,nop,nop,sack 1 {5977:6157}], length 244
22:43:16.172008 IP 165.22.226.250.22 > 66.11.178.156.52947: Flags [P.], seq 10289724:10289968, ack 5941, win 1972, options [nop,nop,TS val 3359211475 ecr 484692681,nop,nop,sack 1 {5977:6157}], length 244
22:43:16.172111 IP 165.22.226.250.22 > 66.11.178.156.52947: Flags [P.], seq 10289968:10290212, ack 5941, win 1972, options [nop,nop,TS val 3359211475 ecr 484692681,nop,nop,sack 1 {5977:6157}], length 244
22:43:16.172208 IP 165.22.226.250.22 > 66.11.178.156.52947: Flags [P.], seq 10290212:10290456, ack 5941, win 1972, options [nop,nop,TS val 3359211475 ecr 484692681,nop,nop,sack 1 {5977:6157}], length 244
22:43:16.172303 IP 165.22.226.250.22 > 66.11.178.156.52947: Flags [P.], seq 10290456:10290700, ack 5941, win 1972, options [nop,nop,TS val 3359211475 ecr 484692681,nop,nop,sack 1 {5977:6157}], length 244
22:43:16.172401 IP 165.22.226.250.22 > 66.11.178.156.52947: Flags [P.], seq 10290700:10290944, ack 5941, win 1972, options [nop,nop,TS val 3359211476 ecr 484692681,nop,nop,sack 1 {5977:6157}], length 244
22:43:16.172500 IP 165.22.226.250.22 > 66.11.178.156.52947: Flags [P.], seq 10290944:10291188, ack 5941, win 1972, options [nop,nop,TS val 3359211476 ecr 484692681,nop,nop,sack 1 {5977:6157}], length 244
22:43:16.172589 IP 165.22.226.250.22 > 66.11.178.156.52947: Flags [P.], seq 10291188:10291432, ack 5941, win 1972, options [nop,nop,TS val 3359211476 ecr 484692681,nop,nop,sack 1 {5977:6157}], length 244
22:43:16.172679 IP 165.22.226.250.22 > 66.11.178.156.52947: Flags [P.], seq 10291432:10291676, ack 5941, win 1972, options [nop,nop,TS val 3359211476 ecr 484692681,nop,nop,sack 1 {5977:6157}], length 244
22:43:16.172765 IP 165.22.226.250.22 > 66.11.178.156.52947: Flags [P.], seq 10291676:10291920, ack 5941, win 1972, options [nop,nop,TS val 3359211476 ecr 484692681,nop,nop,sack 1 {5977:6157}], length 244
22:43:16.172870 IP 165.22.226.250.22 > 66.11.178.156.52947: Flags [P.], seq 10291920:10292164, ack 5941, win 1972, options [nop,nop,TS val 3359211476 ecr 484692681,nop,nop,sack 1 {5977:6157}], length 244
22:43:16.172961 IP 165.22.226.250.22 > 66.11.178.156.52947: Flags [P.], seq 10292164:10292408, ack 5941, win 1972, options [nop,nop,TS val 3359211476 ecr 484692681,nop,nop,sack 1 {5977:6157}], length 244
22:43:16.173048 IP 165.22.226.250.22 > 66.11.178.156.52947: Flags [P.], seq 10292408:10292652, ack 5941, win 1972, options [nop,nop,TS val 3359211476 ecr 484692681,nop,nop,sack 1 {5977:6157}], length 244
22:43:16.173140 IP 165.22.226.250.22 > 66.11.178.156.52947: Flags [P.], seq 10292652:10292896, ack 5941, win 1972, options [nop,nop,TS val 3359211476 ecr 484692681,nop,nop,sack 1 {5977:6157}], length 244
22:43:16.173234 IP 165.22.226.250.22 > 66.11.178.156.52947: Flags [P.], seq 10292896:10293140, ack 5941, win 1972, options [nop,nop,TS val 3359211476 ecr 484692681,nop,nop,sack 1 {5977:6157}], length 244
22:43:16.173323 IP 165.22.226.250.22 > 66.11.178.156.52947: Flags [P.], seq 10293140:10293384, ack 5941, win 1972, options [nop,nop,TS val 3359211476 ecr 484692681,nop,nop,sack 1 {5977:6157}], length 244
22:43:16.173434 IP 165.22.226.250.22 > 66.11.178.156.52947: Flags [P.], seq 10293384:10293628, ack 5941, win 1972, options [nop,nop,TS val 3359211477 ecr 484692681,nop,nop,sack 1 {5977:6157}], length 244
22:43:16.173521 IP 165.22.226.250.22 > 66.11.178.156.52947: Flags [P.], seq 10293628:10293872, ack 5941, win 1972, options [nop,nop,TS val 3359211477 ecr 484692681,nop,nop,sack 1 {5977:6157}], length 244
22:43:16.173615 IP 165.22.226.250.22 > 66.11.178.156.52947: Flags [P.], seq 10293872:10294116, ack 5941, win 1972, options [nop,nop,TS val 3359211477 ecr 484692681,nop,nop,sack 1 {5977:6157}], length 244
22:43:16.173705 IP 165.22.226.250.22 > 66.11.178.156.52947: Flags [P.], seq 10294116:10294360, ack 5941, win 1972, options [nop,nop,TS val 3359211477 ecr 484692681,nop,nop,sack 1 {5977:6157}], length 244
22:43:16.173798 IP 165.22.226.250.22 > 66.11.178.156.52947: Flags [P.], seq 10294360:10294604, ack 5941, win 1972, options [nop,nop,TS val 3359211477 ecr 484692681,nop,nop,sack 1 {5977:6157}], length 244
22:43:16.175154 IP 66.11.178.156.52947 > 165.22.226.250.22: Flags [.], ack 10174424, win 65252, options [nop,nop,TS val 484692839 ecr 3359211377], length 0
22:43:16.175217 IP 165.22.226.250.22 > 66.11.178.156.52947: Flags [P.], seq 10294604:10294848, ack 5941, win 1972, options [nop,nop,TS val 3359211478 ecr 484692681,nop,nop,sack 1 {5977:6157}], length 244
22:43:16.175236 IP 66.11.178.156.52947 > 165.22.226.250.22: Flags [.], ack 10188576, win 65031, options [nop,nop,TS val 484692840 ecr 3359211381], length 0
22:43:16.175295 IP 66.11.178.156.52947 > 165.22.226.250.22: Flags [.], ack 10189796, win 65012, options [nop,nop,TS val 484692840 ecr 3359211381], length 0
22:43:16.175464 IP 165.22.226.250.22 > 66.11.178.156.52947: Flags [P.], seq 10294848:10295564, ack 5941, win 1972, options [nop,nop,TS val 3359211479 ecr 484692681,nop,nop,sack 1 {5977:6157}], length 716
22:43:16.175577 IP 165.22.226.250.22 > 66.11.178.156.52947: Flags [P.], seq 10295564:10295808, ack 5941, win 1972, options [nop,nop,TS val 3359211479 ecr 484692681,nop,nop,sack 1 {5977:6157}], length 244
22:43:16.175676 IP 165.22.226.250.22 > 66.11.178.156.52947: Flags [P.], seq 10295808:10296052, ack 5941, win 1972, options [nop,nop,TS val 3359211479 ecr 484692681,nop,nop,sack 1 {5977:6157}], length 244
22:43:16.175770 IP 165.22.226.250.22 > 66.11.178.156.52947: Flags [P.], seq 10296052:10296296, ack 5941, win 1972, options [nop,nop,TS val 3359211479 ecr 484692681,nop,nop,sack 1 {5977:6157}], length 244
22:43:16.175866 IP 165.22.226.250.22 > 66.11.178.156.52947: Flags [P.], seq 10296296:10296540, ack 5941, win 1972, options [nop,nop,TS val 3359211479 ecr 484692681,nop,nop,sack 1 {5977:6157}], length 244
22:43:16.175954 IP 165.22.226.250.22 > 66.11.178.156.52947: Flags [P.], seq 10296540:10296784, ack 5941, win 1972, options [nop,nop,TS val 3359211479 ecr 484692681,nop,nop,sack 1 {5977:6157}], length 244
22:43:16.176058 IP 165.22.226.250.22 > 66.11.178.156.52947: Flags [P.], seq 10296784:10297028, ack 5941, win 1972, options [nop,nop,TS val 3359211479 ecr 484692681,nop,nop,sack 1 {5977:6157}], length 244
22:43:16.176159 IP 165.22.226.250.22 > 66.11.178.156.52947: Flags [P.], seq 10297028:10297272, ack 5941, win 1972, options [nop,nop,TS val 3359211479 ecr 484692681,nop,nop,sack 1 {5977:6157}], length 244
22:43:16.176249 IP 165.22.226.250.22 > 66.11.178.156.52947: Flags [P.], seq 10297272:10297516, ack 5941, win 1972, options [nop,nop,TS val 3359211479 ecr 484692681,nop,nop,sack 1 {5977:6157}], length 244
22:43:16.176334 IP 165.22.226.250.22 > 66.11.178.156.52947: Flags [P.], seq 10297516:10297760, ack 5941, win 1972, options [nop,nop,TS val 3359211479 ecr 484692681,nop,nop,sack 1 {5977:6157}], length 244
22:43:16.176426 IP 165.22.226.250.22 > 66.11.178.156.52947: Flags [P.], seq 10297760:10298004, ack 5941, win 1972, options [nop,nop,TS val 3359211480 ecr 484692681,nop,nop,sack 1 {5977:6157}], length 244
22:43:16.176510 IP 165.22.226.250.22 > 66.11.178.156.52947: Flags [P.], seq 10298004:10298248, ack 5941, win 1972, options [nop,nop,TS val 3359211480 ecr 484692681,nop,nop,sack 1 {5977:6157}], length 244
22:43:16.176610 IP 165.22.226.250.22 > 66.11.178.156.52947: Flags [P.], seq 10298248:10298492, ack 5941, win 1972, options [nop,nop,TS val 3359211480 ecr 484692681,nop,nop,sack 1 {5977:6157}], length 244
22:43:16.176695 IP 165.22.226.250.22 > 66.11.178.156.52947: Flags [P.], seq 10298492:10298736, ack 5941, win 1972, options [nop,nop,TS val 3359211480 ecr 484692681,nop,nop,sack 1 {5977:6157}], length 244
22:43:16.176778 IP 165.22.226.250.22 > 66.11.178.156.52947: Flags [P.], seq 10298736:10298980, ack 5941, win 1972, options [nop,nop,TS val 3359211480 ecr 484692681,nop,nop,sack 1 {5977:6157}], length 244
22:43:16.176881 IP 165.22.226.250.22 > 66.11.178.156.52947: Flags [P.], seq 10298980:10299224, ack 5941, win 1972, options [nop,nop,TS val 3359211480 ecr 484692681,nop,nop,sack 1 {5977:6157}], length 244
22:43:16.176964 IP 165.22.226.250.22 > 66.11.178.156.52947: Flags [P.], seq 10299224:10299468, ack 5941, win 1972, options [nop,nop,TS val 3359211480 ecr 484692681,nop,nop,sack 1 {5977:6157}], length 244
22:43:16.177045 IP 165.22.226.250.22 > 66.11.178.156.52947: Flags [P.], seq 10299468:10299712, ack 5941, win 1972, options [nop,nop,TS val 3359211480 ecr 484692681,nop,nop,sack 1 {5977:6157}], length 244
22:43:16.177136 IP 165.22.226.250.22 > 66.11.178.156.52947: Flags [P.], seq 10299712:10299956, ack 5941, win 1972, options [nop,nop,TS val 3359211480 ecr 484692681,nop,nop,sack 1 {5977:6157}], length 244
22:43:16.177223 IP 165.22.226.250.22 > 66.11.178.156.52947: Flags [P.], seq 10299956:10300200, ack 5941, win 1972, options [nop,nop,TS val 3359211480 ecr 484692681,nop,nop,sack 1 {5977:6157}], length 244
22:43:16.177313 IP 165.22.226.250.22 > 66.11.178.156.52947: Flags [P.], seq 10300200:10300444, ack 5941, win 1972, options [nop,nop,TS val 3359211480 ecr 484692681,nop,nop,sack 1 {5977:6157}], length 244
22:43:16.177424 IP 165.22.226.250.22 > 66.11.178.156.52947: Flags [P.], seq 10300444:10300688, ack 5941, win 1972, options [nop,nop,TS val 3359211481 ecr 484692681,nop,nop,sack 1 {5977:6157}], length 244
22:43:16.177512 IP 165.22.226.250.22 > 66.11.178.156.52947: Flags [P.], seq 10300688:10300932, ack 5941, win 1972, options [nop,nop,TS val 3359211481 ecr 484692681,nop,nop,sack 1 {5977:6157}], length 244
22:43:16.177601 IP 165.22.226.250.22 > 66.11.178.156.52947: Flags [P.], seq 10300932:10301176, ack 5941, win 1972, options [nop,nop,TS val 3359211481 ecr 484692681,nop,nop,sack 1 {5977:6157}], length 244
