 66-11-178-156.cpe.distributel.net.52947 > 165.22.226.250.ssh: Flags [.], ack 31841, win 65507, options [nop,nop,TS val 484810283 ecr 3359331610], length 0
22:45:16.330010 IP 66-11-178-156.cpe.distributel.net.52947 > 165.22.226.250.ssh: Flags [.], ack 32089, win 65503, options [nop,nop,TS val 484810287 ecr 3359331615], length 0
22:45:16.386089 IP 66-11-178-156.cpe.distributel.net.52947 > 165.22.226.250.ssh: Flags [.], ack 32301, win 65500, options [nop,nop,TS val 484810290 ecr 3359331624], length 0
22:45:16.386131 IP 66-11-178-156.cpe.distributel.net.52947 > 165.22.226.250.ssh: Flags [.], ack 32549, win 65499, options [nop,nop,TS val 484810304 ecr 3359331633], length 0
22:45:16.390149 IP 66-11-178-156.cpe.distributel.net.52947 > 165.22.226.250.ssh: Flags [.], ack 32585, win 65499, options [nop,nop,TS val 484810304 ecr 3359331633], length 0
22:45:16.403888 IP 66-11-178-156.cpe.distributel.net.52947 > 165.22.226.250.ssh: Flags [.], ack 33329, win 65490, options [nop,nop,TS val 484810361 ecr 3359331694], length 0
22:45:16.415713 IP 66-11-178-156.cpe.distributel.net.52947 > 165.22.226.250.ssh: Flags [.], ack 33577, win 65499, options [nop,nop,TS val 484810370 ecr 3359331707], length 0
22:45:16.436506 IP 66-11-178-156.cpe.distributel.net.52947 > 165.22.226.250.ssh: Flags [.], ack 33825, win 65499, options [nop,nop,TS val 484810386 ecr 3359331719], length 0
22:45:16.456552 IP 66-11-178-156.cpe.distributel.net.52947 > 165.22.226.250.ssh: Flags [.], ack 34073, win 65495, options [nop,nop,TS val 484810410 ecr 3359331740], length 0
22:45:16.468232 IP 66-11-178-156.cpe.distributel.net.52947 > 165.22.226.250.ssh: Flags [.], ack 34321, win 65499, options [nop,nop,TS val 484810419 ecr 3359331760], length 0
22:45:16.481954 IP 66-11-178-156.cpe.distributel.net.52947 > 165.22.226.250.ssh: Flags [.], ack 34569, win 65498, options [nop,nop,TS val 484810434 ecr 3359331772], length 0
22:45:16.495715 IP 66-11-178-156.cpe.distributel.net.52947 > 165.22.226.250.ssh: Flags [.], ack 34817, win 65499, options [nop,nop,TS val 484810446 ecr 3359331785], length 0
22:45:16.506462 IP 66-11-178-156.cpe.distributel.net.52947 > 165.22.226.250.ssh: Flags [.], ack 35065, win 65499, options [nop,nop,TS val 484810457 ecr 3359331799], length 0
22:45:16.532269 IP 66-11-178-156.cpe.distributel.net.52947 > 165.22.226.250.ssh: Flags [.], ack 35277, win 65499, options [nop,nop,TS val 484810482 ecr 3359331810], length 0
22:45:16.538161 IP 66-11-178-156.cpe.distributel.net.52947 > 165.22.226.250.ssh: Flags [.], ack 35313, win 65498, options [nop,nop,TS val 484810482 ecr 3359331810], length 0
22:45:16.542178 IP 66-11-178-156.cpe.distributel.net.52947 > 165.22.226.250.ssh: Flags [.], ack 35525, win 65499, options [nop,nop,TS val 484810493 ecr 3359331836], length 0
22:45:16.546304 IP 66-11-178-156.cpe.distributel.net.52947 > 165.22.226.250.ssh: Flags [.], ack 35561, win 65499, options [nop,nop,TS val 484810494 ecr 3359331836], length 0
22:45:16.552831 IP 66-11-178-156.cpe.distributel.net.52947 > 165.22.226.250.ssh: Flags [.], ack 35809, win 65498, options [nop,nop,TS val 484810499 ecr 3359331842], length 0
22:45:16.558338 IP 66-11-178-156.cpe.distributel.net.52947 > 165.22.226.250.ssh: Flags [.], ack 36057, win 65499, options [nop,nop,TS val 484810501 ecr 3359331846], length 0
22:45:16.558391 IP 66-11-178-156.cpe.distributel.net.52947 > 165.22.226.250.ssh: Flags [.], ack 36305, win 65499, options [nop,nop,TS val 484810505 ecr 3359331850], length 0
22:45:16.566819 IP 66-11-178-156.cpe.distributel.net.52947 > 165.22.226.250.ssh: Flags [.], ack 36553, win 65499, options [nop,nop,TS val 484810512 ecr 3359331856], length 0
22:45:16.580686 IP 66-11-178-156.cpe.distributel.net.52947 > 165.22.226.250.ssh: Flags [.], ack 37049, win 65494, options [nop,nop,TS val 484810532 ecr 3359331862], length 0
22:45:16.598282 IP 66-11-178-156.cpe.distributel.net.52947 > 165.22.226.250.ssh: Flags [.], ack 37509, win 65499, options [nop,nop,TS val 484810538 ecr 3359331884], length 0
22:45:16.616591 IP 66-11-178-156.cpe.distributel.net.52947 > 165.22.226.250.ssh: Flags [.], ack 37793, win 65499, options [nop,nop,TS val 484810558 ecr 3359331902], length 0
22:45:16.628311 IP 66-11-178-156.cpe.distributel.net.52947 > 165.22.226.250.ssh: Flags [.], ack 38041, win 65499, options [nop,nop,TS val 484810572 ecr 3359331920], length 0
22:45:16.650067 IP 66-11-178-156.cpe.distributel.net.52947 > 165.22.226.250.ssh: Flags [.], ack 38289, win 65495, options [nop,nop,TS val 484810587 ecr 3359331932], length 0
22:45:16.672898 IP 66-11-178-156.cpe.distributel.net.52947 > 165.22.226.250.ssh: Flags [.], ack 38537, win 65499, options [nop,nop,TS val 484810616 ecr 3359331954], length 0
22:45:16.698498 IP 66-11-178-156.cpe.distributel.net.52947 > 165.22.226.250.ssh: Flags [.], ack 38749, win 65499, options [nop,nop,TS val 484810642 ecr 3359331976], length 0
22:45:16.703639 IP 66-11-178-156.cpe.distributel.net.52947 > 165.22.226.250.ssh: Flags [.], ack 38785, win 65498, options [nop,nop,TS val 484810642 ecr 3359331976], length 0
22:45:16.729885 IP 66-11-178-156.cpe.distributel.net.52947 > 165.22.226.250.ssh: Flags [.], ack 39033, win 65499, options [nop,nop,TS val 484810651 ecr 3359332002], length 0