22:34:23.670521 IP 66-11-178-156.cpe.distributel.net.52947 > 165.22.226.250.ssh: Flags [.], ack 71532113, win 65516, options [nop,nop,TS val 484170381 ecr 3358678956], length 0
22:34:23.670561 IP 66-11-178-156.cpe.distributel.net.52947 > 165.22.226.250.ssh: Flags [.], ack 71547473, win 65472, options [nop,nop,TS val 484170387 ecr 3358678963], length 0
22:34:23.670724 IP 165.22.226.250.ssh > 66-11-178-156.cpe.distributel.net.52947: Flags [P.], seq 71573609:71574205, ack 43920, win 1678, options [nop,nop,TS val 3358678974 ecr 484170377], length 596
22:34:23.670829 IP 165.22.226.250.ssh > 66-11-178-156.cpe.distributel.net.52947: Flags [P.], seq 71574205:71574441, ack 43920, win 1678, options [nop,nop,TS val 3358678974 ecr 484170377], length 236
22:34:23.670930 IP 165.22.226.250.ssh > 66-11-178-156.cpe.distributel.net.52947: Flags [P.], seq 71574441:71574677, ack 43920, win 1678, options [nop,nop,TS val 3358678974 ecr 484170377], length 236
22:34:23.671041 IP 165.22.226.250.ssh > 66-11-178-156.cpe.distributel.net.52947: Flags [P.], seq 71574677:71574913, ack 43920, win 1678, options [nop,nop,TS val 3358678974 ecr 484170377], length 236
22:34:23.671142 IP 165.22.226.250.ssh > 66-11-178-156.cpe.distributel.net.52947: Flags [P.], seq 71574913:71575149, ack 43920, win 1678, options [nop,nop,TS val 3358678974 ecr 484170377], length 236
22:34:23.671243 IP 165.22.226.250.ssh > 66-11-178-156.cpe.distributel.net.52947: Flags [P.], seq 71575149:71575385, ack 43920, win 1678, options [nop,nop,TS val 3358678974 ecr 484170377], length 236
22:34:23.671341 IP 165.22.226.250.ssh > 66-11-178-156.cpe.distributel.net.52947: Flags [P.], seq 71575385:71575621, ack 43920, win 1678, options [nop,nop,TS val 3358678974 ecr 484170377], length 236
22:34:23.671441 IP 165.22.226.250.ssh > 66-11-178-156.cpe.distributel.net.52947: Flags [P.], seq 71575621:71575857, ack 43920, win 1678, options [nop,nop,TS val 3358678975 ecr 484170377], length 236
22:34:23.671541 IP 165.22.226.250.ssh > 66-11-178-156.cpe.distributel.net.52947: Flags [P.], seq 71575857:71576093, ack 43920, win 1678, options [nop,nop,TS val 3358678975 ecr 484170377], length 236
22:34:23.671635 IP 165.22.226.250.ssh > 66-11-178-156.cpe.distributel.net.52947: Flags [P.], seq 71576093:71576329, ack 43920, win 1678, options [nop,nop,TS val 3358678975 ecr 484170377], length 236
22:34:23.671742 IP 165.22.226.250.ssh > 66-11-178-156.cpe.distributel.net.52947: Flags [P.], seq 71576329:71576565, ack 43920, win 1678, options [nop,nop,TS val 3358678975 ecr 484170377], length 236
22:34:23.671852 IP 165.22.226.250.ssh > 66-11-178-156.cpe.distributel.net.52947: Flags [P.], seq 71576565:71576801, ack 43920, win 1678, options [nop,nop,TS val 3358678975 ecr 484170377], length 236
22:34:23.671946 IP 165.22.226.250.ssh > 66-11-178-156.cpe.distributel.net.52947: Flags [P.], seq 71576801:71577037, ack 43920, win 1678, options [nop,nop,TS val 3358678975 ecr 484170377], length 236
22:34:23.672045 IP 165.22.226.250.ssh > 66-11-178-156.cpe.distributel.net.52947: Flags [P.], seq 71577037:71577273, ack 43920, win 1678, options [nop,nop,TS val 3358678975 ecr 484170377], length 236
22:34:23.672142 IP 165.22.226.250.ssh > 66-11-178-156.cpe.distributel.net.52947: Flags [P.], seq 71577273:71577509, ack 43920, win 1678, options [nop,nop,TS val 3358678975 ecr 484170377], length 236
22:34:23.672236 IP 165.22.226.250.ssh > 66-11-178-156.cpe.distributel.net.52947: Flags [P.], seq 71577509:71577745, ack 43920, win 1678, options [nop,nop,TS val 3358678975 ecr 484170377], length 236
22:34:23.672336 IP 165.22.226.250.ssh > 66-11-178-156.cpe.distributel.net.52947: Flags [P.], seq 71577745:71577981, ack 43920, win 1678, options [nop,nop,TS val 3358678975 ecr 484170377], length 236
22:34:23.672427 IP 165.22.226.250.ssh > 66-11-178-156.cpe.distributel.net.52947: Flags [P.], seq 71577981:71578217, ack 43920, win 1678, options [nop,nop,TS val 3358678976 ecr 484170377], length 236
22:34:23.672521 IP 165.22.226.250.ssh > 66-11-178-156.cpe.distributel.net.52947: Flags [P.], seq 71578217:71578453, ack 43920, win 1678, options [nop,nop,TS val 3358678976 ecr 484170377], length 236
22:34:23.672615 IP 165.22.226.250.ssh > 66-11-178-156.cpe.distributel.net.52947: Flags [P.], seq 71578453:71578689, ack 43920, win 1678, options [nop,nop,TS val 3358678976 ecr 484170377], length 236
22:34:23.672710 IP 165.22.226.250.ssh > 66-11-178-156.cpe.distributel.net.52947: Flags [P.], seq 71578689:71578925, ack 43920, win 1678, options [nop,nop,TS val 3358678976 ecr 484170377], length 236
22:34:23.672835 IP 165.22.226.250.ssh > 66-11-178-156.cpe.distributel.net.52947: Flags [P.], seq 71578925:71579161, ack 43920, win 1678, options [nop,nop,TS val 3358678976 ecr 484170377], length 236
22:34:23.672928 IP 165.22.226.250.ssh > 66-11-178-156.cpe.distributel.net.52947: Flags [P.], seq 71579161:71579397, ack 43920, win 1678, options [nop,nop,TS val 3358678976 ecr 484170377], length 236
22:34:23.673023 IP 165.22.226.250.ssh > 66-11-178-156.cpe.distributel.net.52947: Flags [P.], seq 71579397:71579633, ack 43920, win 1678, options [nop,nop,TS val 3358678976 ecr 484170377], length 236
22:34:23.673124 IP 165.22.226.250.ssh > 66-11-178-156.cpe.distributel.net.52947: Flags [P.], seq 71579633:71579869, ack 43920, win 1678, options [nop,nop,TS val 3358678976 ecr 484170377], length 236
22:34:23.673217 IP 165.22.226.250.ssh > 66-11-178-156.cpe.distributel.net.52947: Flags [P.], seq 71579869:71580105, ack 43920, win 1678, options [nop,nop,TS val 3358678976 ecr 484170377], length 236
22:34:23.673312 IP 165.22.226.250.ssh > 66-11-178-156.cpe.distributel.net.52947: Flags [P.], seq 71580105:71580341, ack 43920, win 1678, options [nop,nop,TS val 3358678976 ecr 484170377], length 236
22:34:23.673336 IP 66-11-178-156.cpe.distributel.net.52947 > 165.22.226.250.ssh: Flags [.], ack 71548181, win 65535, options [nop,nop,TS val 484170387 ecr 3358678963], length 0
22:34:23.673354 IP 66-11-178-156.cpe.distributel.net.52947 > 165.22.226.250.ssh: Flags [.], ack 71564877, win 65435, options [nop,nop,TS val 484170389 ecr 3358678970], length 0
22:34:23.673360 IP 66-11-178-156.cpe.distributel.net.52947 > 165.22.226.250.ssh: Flags [P.], seq 43920:43956, ack 71527393, win 65535, options [nop,nop,TS val 484170377 ecr 3358678954], length 36