reading from file 0001.pcap, link-type EN10MB (Ethernet)
22:40:53.926193 IP 165.22.226.250.ssh > 66-11-178-156.cpe.distributel.net.52947: Flags [P.], seq 485864156:485864192, ack 3772835627, win 1926, options [nop,nop,TS val 3359069229 ecr 484552654], length 36
22:40:53.927199 IP 165.22.226.250.ssh > 66-11-178-156.cpe.distributel.net.52947: Flags [P.], seq 36:80, ack 1, win 1926, options [nop,nop,TS val 3359069230 ecr 484552654], length 44
22:40:53.927271 IP 165.22.226.250.ssh > 66-11-178-156.cpe.distributel.net.52947: Flags [P.], seq 80:188, ack 1, win 1926, options [nop,nop,TS val 3359069230 ecr 484552654], length 108
22:40:53.927324 IP 165.22.226.250.ssh > 66-11-178-156.cpe.distributel.net.52947: Flags [P.], seq 188:224, ack 1, win 1926, options [nop,nop,TS val 3359069230 ecr 484552654], length 36
22:40:53.943766 IP 66-11-178-156.cpe.distributel.net.52947 > 165.22.226.250.ssh: Flags [.], ack 80, win 65533, options [nop,nop,TS val 484552683 ecr 3359069230], length 0
22:40:53.947844 IP 66-11-178-156.cpe.distributel.net.52947 > 165.22.226.250.ssh: Flags [.], ack 224, win 65531, options [nop,nop,TS val 484552684 ecr 3359069230], length 0
22:40:55.016761 IP 183.111.96.44.53994 > 165.22.226.250.ssh: Flags [FP.], seq 3825484651:3825484703, ack 728536476, win 262, options [nop,nop,TS val 148242944 ecr 843669730], length 52
22:40:55.016823 IP 165.22.226.250 > 183.111.96.44: ICMP 165.22.226.250 tcp port ssh unreachable, length 112
22:40:55.990481 IP 203.195.191.74.43412 > 165.22.226.250.ssh: Flags [P.], seq 3301392362:3301392802, ack 1227086011, win 245, options [nop,nop,TS val 767543766 ecr 357600211], length 440
22:40:55.990583 IP 165.22.226.250.ssh > 203.195.191.74.43412: Flags [.], ack 488, win 507, options [nop,nop,TS val 357602715 ecr 767543766], length 0
22:40:55.999791 IP 165.22.226.250.ssh > 203.195.191.74.43412: Flags [P.], seq 1:281, ack 488, win 507, options [nop,nop,TS val 357602724 ecr 767543766], length 280
22:40:56.241790 IP 203.195.191.74.43412 > 165.22.226.250.ssh: Flags [.], ack 281, win 262, options [nop,nop,TS val 767543828 ecr 357602724], length 0
22:40:56.246479 IP 203.195.191.74.43412 > 165.22.226.250.ssh: Flags [P.], seq 488:504, ack 281, win 262, options [nop,nop,TS val 767543830 ecr 357602724], length 16
22:40:56.246531 IP 165.22.226.250.ssh > 203.195.191.74.43412: Flags [.], ack 504, win 507, options [nop,nop,TS val 357602971 ecr 767543830], length 0
22:40:56.488514 IP 203.195.191.74.43412 > 165.22.226.250.ssh: Flags [P.], seq 504:556, ack 281, win 262, options [nop,nop,TS val 767543890 ecr 357602971], length 52
22:40:56.488563 IP 165.22.226.250.ssh > 203.195.191.74.43412: Flags [.], ack 556, win 507, options [nop,nop,TS val 357603213 ecr 767543890], length 0
22:40:56.488726 IP 165.22.226.250.ssh > 203.195.191.74.43412: Flags [P.], seq 281:333, ack 556, win 507, options [nop,nop,TS val 357603213 ecr 767543890], length 52
22:40:56.730634 IP 203.195.191.74.43412 > 165.22.226.250.ssh: Flags [P.], seq 556:640, ack 333, win 262, options [nop,nop,TS val 767543951 ecr 357603213], length 84
22:40:56.772888 IP 165.22.226.250.ssh > 203.195.191.74.43412: Flags [.], ack 640, win 507, options [nop,nop,TS val 357603497 ecr 767543951], length 0
22:40:58.001838 IP 221.226.48.102.58040 > 165.22.226.250.ssh: Flags [S], seq 3963352246, win 29200, options [mss 1460,sackOK,TS val 164501965 ecr 0,nop,wscale 7], length 0
22:40:58.001906 IP 165.22.226.250 > 221.226.48.102: ICMP 165.22.226.250 tcp port ssh unreachable, length 68
22:40:59.262222 IP dynamic-ip-18155021112.cable.net.co.10159 > 165.22.226.250.11888: Flags [S], seq 2104246383, win 8192, options [mss 1460,nop,wscale 8,nop,nop,sackOK], length 0
22:41:00.322757 IP v2202101138080138696.megasrv.de.48904 > 165.22.226.250.ssh: Flags [S], seq 4037967320, win 42340, options [mss 1460,sackOK,TS val 465512027 ecr 0,nop,wscale 11], length 0
22:41:00.322813 IP 165.22.226.250 > v2202101138080138696.megasrv.de: ICMP 165.22.226.250 tcp port ssh unreachable, length 68
22:41:01.173587 IP 194.147.140.62.54744 > 165.22.226.250.2177: Flags [S], seq 823436160, win 1024, length 0
22:41:01.329043 IP 165.22.226.250.ssh > 203.195.191.74.43412: Flags [P.], seq 333:401, ack 640, win 507, options [nop,nop,TS val 357608053 ecr 767543951], length 68
22:41:01.571186 IP 203.195.191.74.43412 > 165.22.226.250.ssh: Flags [P.], seq 640:692, ack 401, win 262, options [nop,nop,TS val 767545161 ecr 357608053], length 52
22:41:01.571262 IP 165.22.226.250.ssh > 203.195.191.74.43412: Flags [.], ack 692, win 507, options [nop,nop,TS val 357608295 ecr 767545161], length 0
22:41:01.571289 IP 203.195.191.74.43412 > 165.22.226.250.ssh: Flags [F.], seq 692, ack 401, win 262, options [nop,nop,TS val 767545161 ecr 357608053], length 0
22:41:01.572550 IP 165.22.226.250.ssh > 203.195.191.74.43412: Flags [F.], seq 401, ack 693, win 507, options [nop,nop,TS val 357608297 ecr 767545161], length 0
22:41:01.814360 IP 203.195.191.74.43412 > 165.22.226.250.ssh: Flags [.], ack 402, win 262, options [nop,nop,TS val 767545222 ecr 357608297], length 0
22:41:02.198768 IP dynamic-ip-18155021112.cable.net.co.10159 > 165.22.226.250.11888: Flags [S], seq 2104246383, win 8192, options [mss 1460,nop,wscale 8,nop,nop,sackOK], length 0
22:41:02.720884 IP 165.22.226.250.ssh > 183.111.96.44.53994: Flags [P.], seq 4294967229:1, ack 0, win 507, options [nop,nop,TS val 843706594 ecr 148172854], length 68
22:41:02.957195 IP 183.111.96.44.53994 > 165.22.226.250.ssh: Flags [.], ack 1, win 262, options [nop,nop,TS val 148250884 ecr 843706594,nop,nop,sack 1 {4294967229:1}], length 0
22:41:02.957243 IP 165.22.226.250 > 183.111.96.44: ICMP 165.22.226.250 tcp port ssh unreachable, length 72
22:41:03.772008 IP server-185-153-199-132.cloudedic.net.55448 > 165.22.226.250.ms-wbt-server: Flags [S], seq 172136979, win 1024, length 0
22:41:04.798105 IP 183.111.96.44.57958 > 165.22.226.250.ssh: Flags [S], seq 3368108528, win 29200, options [mss 1460,sackOK,TS val 148252725 ecr 0,nop,wscale 7], length 0
22:41:04.798173 IP 165.22.226.250 > 183.111.96.44: ICMP 165.22.226.250 tcp port ssh unreachable, length 68
22:41:05.800261 IP 183.111.96.44.57958 > 165.22.226.250.ssh: Flags [S], seq 3368108528, win 29200, options [mss 1460,sackOK,TS val 148253728 ecr 0,nop,wscale 7], length 0
22:41:05.800321 IP 165.22.226.250 > 183.111.96.44: ICMP 165.22.226.250 tcp port ssh unreachable, length 68
22:41:07.804165 IP 183.111.96.44.57958 > 165.22.226.250.ssh: Flags [S], seq 3368108528, win 29200, options [mss 1460,sackOK,TS val 148255732 ecr 0,nop,wscale 7], length 0
22:41:07.804243 IP 165.22.226.250 > 183.111.96.44: ICMP 165.22.226.250 tcp port ssh unreachable, length 68
22:41:11.816189 IP 183.111.96.44.57958 > 165.22.226.250.ssh: Flags [S], seq 3368108528, win 29200, options [mss 1460,sackOK,TS val 148259744 ecr 0,nop,wscale 7], length 0
22:41:11.816243 IP 165.22.226.250 > 183.111.96.44: ICMP 165.22.226.250 tcp port ssh unreachable, length 68
22:41:14.457371 IP 194.147.140.70.54914 > 165.22.226.250.6766: Flags [S], seq 1864504047, win 1024, length 0
22:41:18.429242 IP 45.155.205.25.51099 > 165.22.226.250.16605: Flags [S], seq 744269175, win 1024, length 0
22:41:26.332192 IP 49.88.112.72.57454 > 165.22.226.250.ssh: Flags [S], seq 2406185596, win 29200, options [mss 1460,sackOK,TS val 738937805 ecr 0,nop,wscale 7], length 0
22:41:26.332268 IP 165.22.226.250.ssh > 49.88.112.72.57454: Flags [S.], seq 857983221, ack 2406185597, win 65160, options [mss 1460,sackOK,TS val 3301475632 ecr 738937805,nop,wscale 7], length 0
22:41:26.460577 IP ll194-2-11-194-204-194.ll194-2.iam.net.ma.56056 > 165.22.226.250.ssh: Flags [S], seq 4008584571, win 29200, options [mss 1460,sackOK,TS val 633516895 ecr 0,nop,wscale 7], length 0
22:41:26.460651 IP 165.22.226.250 > ll194-2-11-194-204-194.ll194-2.iam.net.ma: ICMP 165.22.226.250 tcp port ssh unreachable, length 68
22:41:26.574949 IP 49.88.112.72.57454 > 165.22.226.250.ssh: Flags [.], ack 1, win 229, options [nop,nop,TS val 738937866 ecr 3301475632], length 0
22:41:26.575025 IP 49.88.112.72.57454 > 165.22.226.250.ssh: Flags [P.], seq 1:16, ack 1, win 229, options [nop,nop,TS val 738937866 ecr 3301475632], length 15
22:41:26.585727 IP 165.22.226.250.ssh > 49.88.112.72.57454: Flags [P.], seq 1:42, ack 1, win 510, options [nop,nop,TS val 3301475886 ecr 738937866], length 41
22:41:26.828363 IP 49.88.112.72.57454 > 165.22.226.250.ssh: Flags [.], ack 42, win 229, options [nop,nop,TS val 738937929 ecr 3301475886], length 0
22:41:27.391526 IP 49.88.112.72.57454 > 165.22.226.250.ssh: Flags [P.], seq 16:872, ack 42, win 229, options [nop,nop,TS val 738938070 ecr 3301475886], length 856
22:41:29.052841 IP 194.147.140.66.54900 > 165.22.226.250.8492: Flags [S], seq 3193454607, win 1024, length 0
22:41:31.809764 IP 104.215.90.147.59340 > 165.22.226.250.http: Flags [SEW], seq 3903279705, win 8192, options [mss 1440,nop,wscale 8,nop,nop,sackOK], length 0
22:41:31.809821 IP 165.22.226.250.http > 104.215.90.147.59340: Flags [S.], seq 3397771120, ack 3903279706, win 64240, options [mss 1460,nop,nop,sackOK,nop,wscale 7], length 0
22:41:31.831637 IP 49.88.112.72.57454 > 165.22.226.250.ssh: Flags [FP.], seq 872:896, ack 42, win 229, options [nop,nop,TS val 738939180 ecr 3301475886], length 24
22:41:31.856877 IP 104.215.90.147.59340 > 165.22.226.250.http: Flags [.], ack 1, win 513, length 0
22:41:31.856917 IP 104.215.90.147.59340 > 165.22.226.250.http: Flags [P.], seq 1:233, ack 1, win 513, length 232: HTTP: GET /.env HTTP/1.1
22:41:31.856979 IP 165.22.226.250.http > 104.215.90.147.59340: Flags [.], ack 233, win 501, length 0
22:41:31.857445 IP 165.22.226.250.http > 104.215.90.147.59340: Flags [P.], seq 1:494, ack 233, win 501, length 493: HTTP: HTTP/1.1 404 Not Found
22:41:31.904435 IP 104.215.90.147.59346 > 165.22.226.250.http: Flags [SEW], seq 3998509840, win 8192, options [mss 1440,nop,wscale 8,nop,nop,sackOK], length 0
22:41:31.904517 IP 165.22.226.250.http > 104.215.90.147.59346: Flags [S.], seq 1885303819, ack 3998509841, win 64240, options [mss 1460,nop,nop,sackOK,nop,wscale 7], length 0
22:41:31.904609 IP 104.215.90.147.59340 > 165.22.226.250.http: Flags [F.], seq 233, ack 494, win 511, length 0
22:41:31.904734 IP 165.22.226.250.http > 104.215.90.147.59340: Flags [F.], seq 494, ack 234, win 501, length 0
22:41:31.948985 IP 104.215.90.147.59346 > 165.22.226.250.http: Flags [.], ack 1, win 513, length 0
22:41:31.949018 IP 104.215.90.147.59346 > 165.22.226.250.http: Flags [P.], seq 1:299, ack 1, win 513, length 298: HTTP: POST / HTTP/1.1
22:41:31.949060 IP 165.22.226.250.http > 104.215.90.147.59346: Flags [.], ack 299, win 501, length 0
22:41:31.949097 IP 104.215.90.147.59346 > 165.22.226.250.http: Flags [P.], seq 299:319, ack 1, win 513, length 20: HTTP
22:41:31.949105 IP 165.22.226.250.http > 104.215.90.147.59346: Flags [.], ack 319, win 501, length 0
22:41:31.949844 IP 165.22.226.250.http > 104.215.90.147.59346: Flags [P.], seq 1:2463, ack 319, win 501, length 2462: HTTP: HTTP/1.1 200 OK
22:41:31.951019 IP 104.215.90.147.59340 > 165.22.226.250.http: Flags [.], ack 495, win 511, length 0
22:41:31.994033 IP 104.215.90.147.59346 > 165.22.226.250.http: Flags [.], ack 2463, win 513, length 0
22:41:31.995308 IP 104.215.90.147.59346 > 165.22.226.250.http: Flags [F.], seq 319, ack 2463, win 513, length 0
22:41:31.995414 IP 165.22.226.250.http > 104.215.90.147.59346: Flags [F.], seq 2463, ack 320, win 501, length 0
22:41:32.039811 IP 104.215.90.147.59346 > 165.22.226.250.http: Flags [.], ack 2464, win 513, length 0
22:41:32.182530 IP 49.88.112.72.57454 > 165.22.226.250.ssh: Flags [FP.], seq 872:896, ack 42, win 229, options [nop,nop,TS val 738939267 ecr 3301475886], length 24
22:41:32.182583 IP 165.22.226.250.ssh > 49.88.112.72.57454: Flags [.], ack 1, win 510, options [nop,nop,TS val 3301481483 ecr 738937866,nop,nop,sack 1 {872:897}], length 0
22:41:32.486823 IP 49.88.112.72.57454 > 165.22.226.250.ssh: Flags [P.], seq 1:872, ack 42, win 229, options [nop,nop,TS val 738939344 ecr 3301481483], length 871
22:41:32.486907 IP 165.22.226.250.ssh > 49.88.112.72.57454: Flags [.], ack 897, win 503, options [nop,nop,TS val 3301481787 ecr 738939344], length 0
22:41:32.488315 IP 165.22.226.250.ssh > 49.88.112.72.57454: Flags [P.], seq 42:1098, ack 897, win 503, options [nop,nop,TS val 3301481788 ecr 738939344], length 1056
22:41:32.490185 IP 165.22.226.250.ssh > 49.88.112.72.57454: Flags [F.], seq 1098, ack 897, win 503, options [nop,nop,TS val 3301481790 ecr 738939344], length 0
22:41:32.693204 IP 195-154-42-43.rev.poneytelecom.eu.51380 > 165.22.226.250.ssh: Flags [S], seq 1191391011, win 29200, options [mss 1460,sackOK,TS val 1890450238 ecr 0,nop,wscale 7], length 0
22:41:32.693256 IP 165.22.226.250 > 195-154-42-43.rev.poneytelecom.eu: ICMP 165.22.226.250 tcp port ssh unreachable, length 68
22:41:32.730898 IP 49.88.112.72.57454 > 165.22.226.250.ssh: Flags [R], seq 2406186493, win 0, length 0
22:41:32.732610 IP 49.88.112.72.57454 > 165.22.226.250.ssh: Flags [R], seq 2406186493, win 0, length 0
22:41:38.197565 IP 104.236.224.69.54424 > 165.22.226.250.ssh: Flags [S], seq 1044593, win 29200, options [mss 1460,sackOK,TS val 293721652 ecr 0,nop,wscale 7], length 0
22:41:38.197650 IP 165.22.226.250.ssh > 104.236.224.69.54424: Flags [S.], seq 3391515730, ack 1044594, win 65160, options [mss 1460,sackOK,TS val 668708238 ecr 293721652,nop,wscale 7], length 0
22:41:38.210935 IP 104.236.224.69.54424 > 165.22.226.250.ssh: Flags [.], ack 1, win 229, options [nop,nop,TS val 293721655 ecr 668708238], length 0
22:41:38.222369 IP 165.22.226.250.ssh > 104.236.224.69.54424: Flags [P.], seq 1:42, ack 1, win 510, options [nop,nop,TS val 668708262 ecr 293721655], length 41
22:41:38.235136 IP 104.236.224.69.54424 > 165.22.226.250.ssh: Flags [.], ack 42, win 229, options [nop,nop,TS val 293721661 ecr 668708262], length 0
22:41:38.235313 IP 104.236.224.69.54424 > 165.22.226.250.ssh: Flags [P.], seq 1:22, ack 42, win 229, options [nop,nop,TS val 293721661 ecr 668708262], length 21
22:41:38.235337 IP 165.22.226.250.ssh > 104.236.224.69.54424: Flags [.], ack 22, win 510, options [nop,nop,TS val 668708275 ecr 293721661], length 0
22:41:38.237165 IP 165.22.226.250.ssh > 104.236.224.69.54424: Flags [P.], seq 42:1098, ack 22, win 510, options [nop,nop,TS val 668708277 ecr 293721661], length 1056
22:41:38.249980 IP 104.236.224.69.54424 > 165.22.226.250.ssh: Flags [P.], seq 22:462, ack 1098, win 245, options [nop,nop,TS val 293721665 ecr 668708277], length 440
22:41:38.250051 IP 165.22.226.250.ssh > 104.236.224.69.54424: Flags [.], ack 462, win 507, options [nop,nop,TS val 668708290 ecr 293721665], length 0
22:41:38.262903 IP 104.236.224.69.54424 > 165.22.226.250.ssh: Flags [P.], seq 462:510, ack 1098, win 245, options [nop,nop,TS val 293721668 ecr 668708290], length 48
22:41:38.262960 IP 165.22.226.250.ssh > 104.236.224.69.54424: Flags [.], ack 510, win 507, options [nop,nop,TS val 668708303 ecr 293721668], length 0
22:41:38.268703 IP 165.22.226.250.ssh > 104.236.224.69.54424: Flags [P.], seq 1098:1378, ack 510, win 507, options [nop,nop,TS val 668708309 ecr 293721668], length 280
22:41:38.283960 IP 104.236.224.69.54424 > 165.22.226.250.ssh: Flags [P.], seq 510:526, ack 1378, win 262, options [nop,nop,TS val 293721673 ecr 668708309], length 16
22:41:38.284021 IP 165.22.226.250.ssh > 104.236.224.69.54424: Flags [.], ack 526, win 507, options [nop,nop,TS val 668708324 ecr 293721673], length 0
22:41:38.296632 IP 104.236.224.69.54424 > 165.22.226.250.ssh: Flags [P.], seq 526:578, ack 1378, win 262, options [nop,nop,TS val 293721677 ecr 668708324], length 52
22:41:38.296671 IP 165.22.226.250.ssh > 104.236.224.69.54424: Flags [.], ack 578, win 507, options [nop,nop,TS val 668708337 ecr 293721677], length 0
22:41:38.296819 IP 165.22.226.250.ssh > 104.236.224.69.54424: Flags [P.], seq 1378:1430, ack 578, win 507, options [nop,nop,TS val 668708337 ecr 293721677], length 52
22:41:38.313957 IP 104.236.224.69.54424 > 165.22.226.250.ssh: Flags [P.], seq 578:678, ack 1430, win 262, options [nop,nop,TS val 293721681 ecr 668708337], length 100
22:41:38.356890 IP 165.22.226.250.ssh > 104.236.224.69.54424: Flags [.], ack 678, win 507, options [nop,nop,TS val 668708397 ecr 293721681], length 0
22:41:40.176707 IP 165.22.226.250.ssh > 104.236.224.69.54424: Flags [P.], seq 1430:1498, ack 678, win 507, options [nop,nop,TS val 668710217 ecr 293721681], length 68
22:41:40.189630 IP 104.236.224.69.54424 > 165.22.226.250.ssh: Flags [P.], seq 678:730, ack 1498, win 262, options [nop,nop,TS val 293722150 ecr 668710217], length 52
22:41:40.189683 IP 165.22.226.250.ssh > 104.236.224.69.54424: Flags [.], ack 730, win 507, options [nop,nop,TS val 668710230 ecr 293722150], length 0
22:41:40.189711 IP 104.236.224.69.54424 > 165.22.226.250.ssh: Flags [F.], seq 730, ack 1498, win 262, options [nop,nop,TS val 293722150 ecr 668710217], length 0
22:41:40.191507 IP 165.22.226.250.ssh > 104.236.224.69.54424: Flags [F.], seq 1498, ack 731, win 507, options [nop,nop,TS val 668710232 ecr 293722150], length 0
22:41:40.204171 IP 104.236.224.69.54424 > 165.22.226.250.ssh: Flags [.], ack 1499, win 262, options [nop,nop,TS val 293722153 ecr 668710232], length 0
22:41:43.934886 IP 165.22.226.250.ssh > 183.111.96.44.53994: Flags [F.], seq 1, ack 0, win 507, options [nop,nop,TS val 843747808 ecr 148172854], length 0
22:41:44.174699 IP 183.111.96.44.53994 > 165.22.226.250.ssh: Flags [.], ack 2, win 262, options [nop,nop,TS val 148292101 ecr 843747808], length 0
22:41:44.174752 IP 165.22.226.250 > 183.111.96.44: ICMP 165.22.226.250 tcp port ssh unreachable, length 60
22:41:45.960342 IP 45.155.205.23.51083 > 165.22.226.250.7447: Flags [S], seq 885398814, win 1024, length 0
22:41:49.443892 IP 49.88.211.88.48753 > 165.22.226.250.ssh: Flags [S], seq 90887741, win 29040, options [mss 1412,sackOK,TS val 2410183722 ecr 0,nop,wscale 6], length 0
22:41:49.443963 IP 165.22.226.250.ssh > 49.88.211.88.48753: Flags [S.], seq 3489385102, ack 90887742, win 65160, options [mss 1460,sackOK,TS val 2947954041 ecr 2410183722,nop,wscale 7], length 0
22:41:50.103735 IP 49.88.211.88.48753 > 165.22.226.250.ssh: Flags [.], ack 1, win 454, options [nop,nop,TS val 2410184350 ecr 2947954041], length 0
22:41:50.115243 IP 165.22.226.250.ssh > 49.88.211.88.48753: Flags [P.], seq 1:42, ack 1, win 510, options [nop,nop,TS val 2947954712 ecr 2410184350], length 41
22:41:50.658246 IP 49.88.211.88.48753 > 165.22.226.250.ssh: Flags [.], ack 42, win 454, options [nop,nop,TS val 2410184921 ecr 2947954712], length 0
22:41:50.658289 IP 49.88.211.88.48753 > 165.22.226.250.ssh: Flags [P.], seq 1:22, ack 42, win 454, options [nop,nop,TS val 2410184992 ecr 2947954712], length 21
22:41:50.658310 IP 165.22.226.250.ssh > 49.88.211.88.48753: Flags [.], ack 22, win 510, options [nop,nop,TS val 2947955255 ecr 2410184992], length 0
22:41:50.660166 IP 165.22.226.250.ssh > 49.88.211.88.48753: Flags [P.], seq 42:1098, ack 22, win 510, options [nop,nop,TS val 2947955257 ecr 2410184992], length 1056
22:41:51.342034 IP 49.88.211.88.48753 > 165.22.226.250.ssh: Flags [.], ack 1098, win 487, options [nop,nop,TS val 2410185550 ecr 2947955257], length 0
22:41:51.342067 IP 49.88.211.88.48753 > 165.22.226.250.ssh: Flags [P.], seq 22:462, ack 1098, win 487, options [nop,nop,TS val 2410185554 ecr 2947955257], length 440
22:41:51.342083 IP 165.22.226.250.ssh > 49.88.211.88.48753: Flags [.], ack 462, win 507, options [nop,nop,TS val 2947955939 ecr 2410185554], length 0
22:41:52.135169 IP 49.88.211.88.48753 > 165.22.226.250.ssh: Flags [P.], seq 462:510, ack 1098, win 487, options [nop,nop,TS val 2410186575 ecr 2947955939], length 48
22:41:52.135239 IP 165.22.226.250.ssh > 49.88.211.88.48753: Flags [.], ack 510, win 507, options [nop,nop,TS val 2947956732 ecr 2410186575], length 0
22:41:52.142472 IP 165.22.226.250.ssh > 49.88.211.88.48753: Flags [P.], seq 1098:1378, ack 510, win 507, options [nop,nop,TS val 2947956740 ecr 2410186575], length 280
22:41:53.594216 IP 49.88.211.88.48753 > 165.22.226.250.ssh: Flags [P.], seq 462:510, ack 1098, win 487, options [nop,nop,TS val 2410187916 ecr 2947955939], length 48
22:41:53.594273 IP 165.22.226.250.ssh > 49.88.211.88.48753: Flags [.], ack 510, win 507, options [nop,nop,TS val 2947958191 ecr 2410187916,nop,nop,sack 1 {462:510}], length 0
22:41:53.664873 IP 165.22.226.250.ssh > 49.88.211.88.48753: Flags [P.], seq 1098:1378, ack 510, win 507, options [nop,nop,TS val 2947958262 ecr 2410187916], length 280
22:41:55.552882 IP 165.22.226.250.ssh > 49.88.211.88.48753: Flags [P.], seq 1098:1378, ack 510, win 507, options [nop,nop,TS val 2947960150 ecr 2410187916], length 280
22:41:56.129671 IP 49.88.211.88.48753 > 165.22.226.250.ssh: Flags [.], ack 1378, win 520, options [nop,nop,TS val 2410190464 ecr 2947960150], length 0
22:41:56.130132 IP 49.88.211.88.48753 > 165.22.226.250.ssh: Flags [P.], seq 510:526, ack 1378, win 520, options [nop,nop,TS val 2410190512 ecr 2947960150], length 16
22:41:56.130163 IP 165.22.226.250.ssh > 49.88.211.88.48753: Flags [.], ack 526, win 507, options [nop,nop,TS val 2947960727 ecr 2410190512], length 0
22:41:56.612293 IP 49.88.211.88.48753 > 165.22.226.250.ssh: Flags [P.], seq 526:578, ack 1378, win 520, options [nop,nop,TS val 2410191044 ecr 2947960727], length 52
22:41:56.612332 IP 165.22.226.250.ssh > 49.88.211.88.48753: Flags [.], ack 578, win 507, options [nop,nop,TS val 2947961209 ecr 2410191044], length 0
22:41:56.612509 IP 165.22.226.250.ssh > 49.88.211.88.48753: Flags [P.], seq 1378:1430, ack 578, win 507, options [nop,nop,TS val 2947961210 ecr 2410191044], length 52
22:41:57.428270 IP 49.88.211.88.48753 > 165.22.226.250.ssh: Flags [.], ack 1430, win 520, options [nop,nop,TS val 2410191758 ecr 2947961210], length 0
22:41:57.439041 IP 49.88.211.88.48753 > 165.22.226.250.ssh: Flags [P.], seq 578:662, ack 1430, win 520, options [nop,nop,TS val 2410191807 ecr 2947961210], length 84
22:41:57.439085 IP 165.22.226.250.ssh > 49.88.211.88.48753: Flags [.], ack 662, win 507, options [nop,nop,TS val 2947962036 ecr 2410191807], length 0
22:42:00.231940 IP 165.22.226.250.ssh > 49.88.211.88.48753: Flags [P.], seq 1430:1498, ack 662, win 507, options [nop,nop,TS val 2947964829 ecr 2410191807], length 68
22:42:01.228124 IP 49.88.211.88.48753 > 165.22.226.250.ssh: Flags [.], ack 1498, win 520, options [nop,nop,TS val 2410195358 ecr 2947964829], length 0
22:42:01.228179 IP 165.22.226.250 > 49.88.211.88: ICMP 165.22.226.250 tcp port ssh unreachable, length 60
22:42:01.228196 IP 49.88.211.88.48753 > 165.22.226.250.ssh: Flags [P.], seq 662:714, ack 1498, win 520, options [nop,nop,TS val 2410195398 ecr 2947964829], length 52
22:42:01.228202 IP 165.22.226.250 > 49.88.211.88: ICMP 165.22.226.250 tcp port ssh unreachable, length 112
22:42:01.228204 IP 49.88.211.88.48753 > 165.22.226.250.ssh: Flags [F.], seq 714, ack 1498, win 520, options [nop,nop,TS val 2410195398 ecr 2947964829], length 0
22:42:01.228208 IP 165.22.226.250 > 49.88.211.88: ICMP 165.22.226.250 tcp port ssh unreachable, length 60
22:42:01.760888 IP 165.22.226.250.ssh > 49.88.211.88.48753: Flags [P.], seq 1430:1498, ack 662, win 507, options [nop,nop,TS val 2947966358 ecr 2410191807], length 68
22:42:02.264422 IP 49.88.211.88.48753 > 165.22.226.250.ssh: Flags [F.], seq 714, ack 1498, win 520, options [nop,nop,TS val 2410196674 ecr 2947964829], length 0
22:42:02.264502 IP 165.22.226.250 > 49.88.211.88: ICMP 165.22.226.250 tcp port ssh unreachable, length 60
22:42:02.718263 IP 49.88.211.88.48753 > 165.22.226.250.ssh: Flags [.], ack 1498, win 520, options [nop,nop,TS val 2410197181 ecr 2947966358,nop,nop,sack 1 {1430:1498}], length 0
22:42:02.718323 IP 165.22.226.250 > 49.88.211.88: ICMP 165.22.226.250 tcp port ssh unreachable, length 72
22:42:03.424894 IP 165.22.226.250.ssh > 49.88.211.88.48753: Flags [P.], seq 1430:1498, ack 662, win 507, options [nop,nop,TS val 2947968022 ecr 2410191807], length 68
22:42:03.825609 IP v2202101138080138696.megasrv.de.37988 > 165.22.226.250.ssh: Flags [S], seq 2633077891, win 42340, options [mss 1460,sackOK,TS val 465575528 ecr 0,nop,wscale 11], length 0
22:42:03.825678 IP 165.22.226.250 > v2202101138080138696.megasrv.de: ICMP 165.22.226.250 tcp port ssh unreachable, length 68
22:42:04.093977 IP 49.88.211.88.48753 > 165.22.226.250.ssh: Flags [.], ack 1498, win 520, options [nop,nop,TS val 2410198317 ecr 2947968022,nop,nop,sack 1 {1430:1498}], length 0
22:42:04.094037 IP 165.22.226.250 > 49.88.211.88: ICMP 165.22.226.250 tcp port ssh unreachable, length 72
22:42:06.715674 IP 49.88.211.88.48753 > 165.22.226.250.ssh: Flags [FP.], seq 662:714, ack 1498, win 520, options [nop,nop,TS val 2410201144 ecr 2947968022], length 52
22:42:06.715751 IP 165.22.226.250 > 49.88.211.88: ICMP 165.22.226.250 tcp port ssh unreachable, length 112
22:42:06.976887 IP 165.22.226.250.ssh > 49.88.211.88.48753: Flags [P.], seq 1430:1498, ack 662, win 507, options [nop,nop,TS val 2947971574 ecr 2410191807], length 68
22:42:07.823838 IP 49.88.211.88.48753 > 165.22.226.250.ssh: Flags [.], ack 1498, win 520, options [nop,nop,TS val 2410202091 ecr 2947971574,nop,nop,sack 1 {1430:1498}], length 0
22:42:07.823903 IP 165.22.226.250 > 49.88.211.88: ICMP 165.22.226.250 tcp port ssh unreachable, length 72
22:42:09.882499 IP 49.88.211.88.48753 > 165.22.226.250.ssh: Flags [FP.], seq 662:714, ack 1498, win 520, options [nop,nop,TS val 2410204256 ecr 2947971574], length 52
22:42:09.882552 IP 165.22.226.250 > 49.88.211.88: ICMP 165.22.226.250 tcp port ssh unreachable, length 112